,sentences,paragraph
1717,"Something warm and pleasant welled up in Marilla’s heart at touch of that thin little hand in her own--a throb of the maternity she had missed, perhaps.",499
1718,Its very unaccustomedness and sweetness disturbed her.,499
1719,She hastened to restore her sensations to their normal calm by inculcating a moral.,499
1720,"“If you’ll be a good girl you’ll always be happy, Anne.",500
1721,And you should never find it hard to say your prayers.”,500
1722,"“Saying one’s prayers isn’t exactly the same thing as praying,” said Anne meditatively.",501
1723,“But I’m going to imagine that I’m the wind that is blowing up there in those tree tops.,501
1724,When I get tired of the trees I’ll imagine I’m gently waving down here in the ferns--and then I’ll fly over to Mrs. Lynde’s garden and set the flowers dancing--and then I’ll go with one great swoop over the clover field--and then I’ll blow over the Lake of Shining Waters and ripple it all up into little sparkling waves.,501
1725,"Oh, there’s so much scope for imagination in a wind!",501
1726,"So I’ll not talk any more just now, Marilla.”",501
1727,"“Thanks be to goodness for that,” breathed Marilla in devout relief.",502
1728, CHAPTER XI.,504
1729,Anne’s Impressions of Sunday-school,504
1730," WELL, how do you like them?” said Marilla.",505
1731,"Anne was standing in the gable room, looking solemnly at three new dresses spread out on the bed.",506
1732,One was of snuffy colored gingham which Marilla had been tempted to buy from a peddler the preceding summer because it looked so serviceable; one was of black-and-white checkered sateen which she had picked up at a bargain counter in the winter; and one was a stiff print of an ugly blue shade which she had purchased that week at a Carmody store.,506
1733,"She had made them up herself, and they were all made alike--plain skirts fulled tightly to plain waists, with sleeves as plain as waist and skirt and tight as sleeves could be.",507
1734,"“I’ll imagine that I like them,” said Anne soberly.",508
1735,"“I don’t want you to imagine it,” said Marilla, offended.",509
1736,"“Oh, I can see you don’t like the dresses!",509
1737,What is the matter with them?,509
1738,Aren’t they neat and clean and new?”,509
1739,“Yes.”,510
1740,“Then why don’t you like them?”,511
1741,"“They’re--they’re not--pretty,” said Anne reluctantly.",512
1742,“Pretty!” Marilla sniffed.,513
1743,“I didn’t trouble my head about getting pretty dresses for you.,513
1744,"I don’t believe in pampering vanity, Anne, I’ll tell you that right off.",513
1745,"Those dresses are good, sensible, serviceable dresses, without any frills or furbelows about them, and they’re all you’ll get this summer.",513
1746,The brown gingham and the blue print will do you for school when you begin to go.,513
1747,The sateen is for church and Sunday-school.,513
1748,I’ll expect you to keep them neat and clean and not to tear them.,513
1749,I should think you’d be grateful to get most anything after those skimpy wincey things you’ve been wearing.”,513
1750,"“Oh, I _am_ grateful,” protested Anne.",514
1751,“But I’d be ever so much gratefuller if--if you’d made just one of them with puffed sleeves.,514
1752,Puffed sleeves are so fashionable now.,514
1753,"It would give me such a thrill, Marilla, just to wear a dress with puffed sleeves.”",514
1754,"“Well, you’ll have to do without your thrill.",515
1755,I hadn’t any material to waste on puffed sleeves.,515
1756,I think they are ridiculous-looking things anyhow.,515
1757,"I prefer the plain, sensible ones.”",515
1758,"“But I’d rather look ridiculous when everybody else does than plain and sensible all by myself,” persisted Anne mournfully.",516
1759,“Trust you for that!,517
1760,"Well, hang those dresses carefully up in your closet, and then sit down and learn the Sunday-school lesson.",517
1761,"I got a quarterly from Mr. Bell for you and you’ll go to Sunday-school tomorrow,” said Marilla, disappearing downstairs in high dudgeon.",517
1762,Anne clasped her hands and looked at the dresses.,518
1763,"“I did hope there would be a white one with puffed sleeves,” she whispered disconsolately.",519
1764,"“I prayed for one, but I didn’t much expect it on that account.",519
1765,I didn’t suppose God would have time to bother about a little orphan girl’s dress.,519
1766,I knew I’d just have to depend on Marilla for it.,519
1767,"Well, fortunately I can imagine that one of them is of snow-white muslin with lovely lace frills and three-puffed sleeves.”",519
1768,The next morning warnings of a sick headache prevented Marilla from going to Sunday-school with Anne.,520
1769,"“You’ll have to go down and call for Mrs. Lynde, Anne,” she said.",521
1770,“She’ll see that you get into the right class.,521
1771,"Now, mind you behave yourself properly.",521
1772,Stay to preaching afterwards and ask Mrs. Lynde to show you our pew.,521
1773,Here’s a cent for collection.,521
1774,Don’t stare at people and don’t fidget.,521
1775,I shall expect you to tell me the text when you come home.”,521
1776,"Anne started off irreproachable, arrayed in the stiff black-and-white sateen, which, while decent as regards length and certainly not open to the charge of skimpiness, contrived to emphasize every corner and angle of her thin figure.",522
1777,"Her hat was a little, flat, glossy, new sailor, the extreme plainness of which had likewise much disappointed Anne, who had permitted herself secret visions of ribbon and flowers.",522
1778,"The latter, however, were supplied before Anne reached the main road, for being confronted halfway down the lane with a golden frenzy of wind-stirred buttercups and a glory of wild roses, Anne promptly and liberally garlanded her hat with a heavy wreath of them.",522
1779,"Whatever other people might have thought of the result it satisfied Anne, and she tripped gaily down the road, holding her ruddy head with its decoration of pink and yellow very proudly.",522
1780,When she had reached Mrs. Lynde’s house she found that lady gone.,523
1781,"Nothing daunted, Anne proceeded onward to the church alone.",523
1782,"In the porch she found a crowd of little girls, all more or less gaily attired in whites and blues and pinks, and all staring with curious eyes at this stranger in their midst, with her extraordinary head adornment.",523
1783,Avonlea little girls had already heard queer stories about Anne.,523
1784,"Mrs. Lynde said she had an awful temper; Jerry Buote, the hired boy at Green Gables, said she talked all the time to herself or to the trees and flowers like a crazy girl.",523
1785,They looked at her and whispered to each other behind their quarterlies.,523
1786,"Nobody made any friendly advances, then or later on when the opening exercises were over and Anne found herself in Miss Rogerson’s class.",523
1787,Miss Rogerson was a middle-aged lady who had taught a Sunday-school class for twenty years.,524
1788,Her method of teaching was to ask the printed questions from the quarterly and look sternly over its edge at the particular little girl she thought ought to answer the question.,524
1789,"She looked very often at Anne, and Anne, thanks to Marilla’s drilling, answered promptly; but it may be questioned if she understood very much about either question or answer.",524
1790,"She did not think she liked Miss Rogerson, and she felt very miserable; every other little girl in the class had puffed sleeves.",525
1791,Anne felt that life was really not worth living without puffed sleeves.,525
1792,"“Well, how did you like Sunday-school?” Marilla wanted to know when Anne came home.",526
1793,"Her wreath having faded, Anne had discarded it in the lane, so Marilla was spared the knowledge of that for a time.",526
1794,“I didn’t like it a bit.,527
1795,It was horrid.”,527
1796,“Anne Shirley!” said Marilla rebukingly.,528
1797,"Anne sat down on the rocker with a long sigh, kissed one of Bonny’s leaves, and waved her hand to a blossoming fuchsia.",529
1798,"“They might have been lonesome while I was away,” she explained.",530
1799,“And now about the Sunday-school.,530
1800,"I behaved well, just as you told me.",530
1801,"Mrs. Lynde was gone, but I went right on myself.",530
1802,"I went into the church, with a lot of other little girls, and I sat in the corner of a pew by the window while the opening exercises went on.",530
1803,Mr. Bell made an awfully long prayer.,530
1804,I would have been dreadfully tired before he got through if I hadn’t been sitting by that window.,530
1805,"But it looked right out on the Lake of Shining Waters, so I just gazed at that and imagined all sorts of splendid things.”",530
1806,“You shouldn’t have done anything of the sort.,531
1807,You should have listened to Mr. Bell.”,531
1808,"“But he wasn’t talking to me,” protested Anne.",532
1809,"“He was talking to God and he didn’t seem to be very much interested in it, either.",532
1810,I think he thought God was too far off though.,532
1811,"There was a long row of white birches hanging over the lake and the sunshine fell down through them, ‘way, ‘way down, deep into the water.",532
1812,"Oh, Marilla, it was like a beautiful dream!",532
1813,"It gave me a thrill and I just said, ‘Thank you for it, God,’ two or three times.”",532
1814,"“Not out loud, I hope,” said Marilla anxiously.",533
1815,"“Oh, no, just under my breath.",534
1816,"Well, Mr. Bell did get through at last and they told me to go into the classroom with Miss Rogerson’s class.",534
1817,There were nine other girls in it.,534
1818,They all had puffed sleeves.,534
1819,"I tried to imagine mine were puffed, too, but I couldn’t.",534
1820,Why couldn’t I?,534
1821,"It was as easy as could be to imagine they were puffed when I was alone in the east gable, but it was awfully hard there among the others who had really truly puffs.”",534
1822,“You shouldn’t have been thinking about your sleeves in Sunday-school.,535
1823,You should have been attending to the lesson.,535
1824,I hope you knew it.”,535
1825,"“Oh, yes; and I answered a lot of questions.",536
1826,Miss Rogerson asked ever so many.,536
1827,I don’t think it was fair for her to do all the asking.,536
1828,"There were lots I wanted to ask her, but I didn’t like to because I didn’t think she was a kindred spirit.",536
1829,Then all the other little girls recited a paraphrase.,536
1830,She asked me if I knew any.,536
1831,"I told her I didn’t, but I could recite, ‘The Dog at His Master’s Grave’ if she liked.",536
1832,That’s in the Third Royal Reader.,536
1833,"It isn’t a really truly religious piece of poetry, but it’s so sad and melancholy that it might as well be.",536
1834,She said it wouldn’t do and she told me to learn the nineteenth paraphrase for next Sunday.,536
1835,I read it over in church afterwards and it’s splendid.,536
1836,There are two lines in particular that just thrill me.,536
1837,   “‘Quick as the slaughtered squadrons fell      In Midian’s evil day.’,537
1838,"“I don’t know what ‘squadrons’ means nor ‘Midian,’ either, but it sounds _so_ tragical.",538
1839,I can hardly wait until next Sunday to recite it.,538
1840,I’ll practice it all the week.,538
1841,After Sunday-school I asked Miss Rogerson--because Mrs. Lynde was too far away--to show me your pew.,538
1842,"I sat just as still as I could and the text was Revelations, third chapter, second and third verses.",538
1843,It was a very long text.,538
1844,"If I was a minister I’d pick the short, snappy ones.",538
1845,"The sermon was awfully long, too.",538
1846,I suppose the minister had to match it to the text.,538
1847,I didn’t think he was a bit interesting.,538
1848,The trouble with him seems to be that he hasn’t enough imagination.,538
1849,I didn’t listen to him very much.,538
1850,I just let my thoughts run and I thought of the most surprising things.”,538
1851,"Marilla felt helplessly that all this should be sternly reproved, but she was hampered by the undeniable fact that some of the things Anne had said, especially about the minister’s sermons and Mr. Bell’s prayers, were what she herself had really thought deep down in her heart for years, but had never given expression to.",539
1852,"It almost seemed to her that those secret, unuttered, critical thoughts had suddenly taken visible and accusing shape and form in the person of this outspoken morsel of neglected humanity.",539
1853, CHAPTER XII.,541
1854,A Solemn Vow and Promise,541
1855, IT was not until the next Friday that Marilla heard the story of the flower-wreathed hat.,542
1856,She came home from Mrs. Lynde’s and called Anne to account.,542
1857,"“Anne, Mrs. Rachel says you went to church last Sunday with your hat rigged out ridiculous with roses and buttercups.",543
1858,What on earth put you up to such a caper?,543
1859,A pretty-looking object you must have been!”,543
1860,“Oh.,544
1861,"I know pink and yellow aren’t becoming to me,” began Anne.",544
1862,“Becoming fiddlesticks!,545
1863,"It was putting flowers on your hat at all, no matter what color they were, that was ridiculous.",545
1864,You are the most aggravating child!”,545
1865,"“I don’t see why it’s any more ridiculous to wear flowers on your hat than on your dress,” protested Anne.",546
1866,“Lots of little girls there had bouquets pinned on their dresses.,546
1867,What’s the difference?”,546
1868,Marilla was not to be drawn from the safe concrete into dubious paths of the abstract.,547
1869,"“Don’t answer me back like that, Anne.",548
1870,It was very silly of you to do such a thing.,548
1871,Never let me catch you at such a trick again.,548
1872,Mrs. Rachel says she thought she would sink through the floor when she saw you come in all rigged out like that.,548
1873,She couldn’t get near enough to tell you to take them off till it was too late.,548
1874,She says people talked about it something dreadful.,548
1875,Of course they would think I had no better sense than to let you go decked out like that.”,548
1876,"“Oh, I’m so sorry,” said Anne, tears welling into her eyes.",549
1877,“I never thought you’d mind.,549
1878,The roses and buttercups were so sweet and pretty I thought they’d look lovely on my hat.,549
1879,Lots of the little girls had artificial flowers on their hats.,549
1880,I’m afraid I’m going to be a dreadful trial to you.,549
1881,Maybe you’d better send me back to the asylum.,549
1882,"That would be terrible; I don’t think I could endure it; most likely I would go into consumption; I’m so thin as it is, you see.",549
1883,But that would be better than being a trial to you.”,549
1884,"“Nonsense,” said Marilla, vexed at herself for having made the child cry.",550
1885,"“I don’t want to send you back to the asylum, I’m sure.",550
1886,All I want is that you should behave like other little girls and not make yourself ridiculous.,550
1887,Don’t cry any more.,550
1888,I’ve got some news for you.,550
1889,Diana Barry came home this afternoon.,550
1890,"I’m going up to see if I can borrow a skirt pattern from Mrs. Barry, and if you like you can come with me and get acquainted with Diana.”",550
1891,"Anne rose to her feet, with clasped hands, the tears still glistening on her cheeks; the dish towel she had been hemming slipped unheeded to the floor.",551
1892,"“Oh, Marilla, I’m frightened--now that it has come I’m actually frightened.",552
1893,What if she shouldn’t like me!,552
1894,It would be the most tragical disappointment of my life.”,552
1895,"“Now, don’t get into a fluster.",553
1896,And I do wish you wouldn’t use such long words.,553
1897,It sounds so funny in a little girl.,553
1898,I guess Diana ‘ll like you well enough.,553
1899,It’s her mother you’ve got to reckon with.,553
1900,If she doesn’t like you it won’t matter how much Diana does.,553
1901,If she has heard about your outburst to Mrs. Lynde and going to church with buttercups round your hat I don’t know what she’ll think of you.,553
1902,"You must be polite and well behaved, and don’t make any of your startling speeches.",553
1903,"For pity’s sake, if the child isn’t actually trembling!”",553
1904,Anne _was_ trembling.,554
1905,Her face was pale and tense.,554
1906,"“Oh, Marilla, you’d be excited, too, if you were going to meet a little girl you hoped to be your bosom friend and whose mother mightn’t like you,” she said as she hastened to get her hat.",555
1907,They went over to Orchard Slope by the short cut across the brook and up the firry hill grove.,556
1908,Mrs. Barry came to the kitchen door in answer to Marilla’s knock.,556
1909,"She was a tall black-eyed, black-haired woman, with a very resolute mouth.",556
1910,She had the reputation of being very strict with her children.,556
1911,"“How do you do, Marilla?” she said cordially.",557
1912,“Come in.,557
1913,"And this is the little girl you have adopted, I suppose?”",557
1914,"“Yes, this is Anne Shirley,” said Marilla.",558
1915,"“Spelled with an E,” gasped Anne, who, tremulous and excited as she was, was determined there should be no misunderstanding on that important point.",559
1916,"Mrs. Barry, not hearing or not comprehending, merely shook hands and said kindly:",560
1917,“How are you?”,561
1918,"“I am well in body although considerable rumpled up in spirit, thank you ma’am,” said Anne gravely.",562
1919,"Then aside to Marilla in an audible whisper, “There wasn’t anything startling in that, was there, Marilla?”",562
1920,"Diana was sitting on the sofa, reading a book which she dropped when the callers entered.",563
1921,"She was a very pretty little girl, with her mother’s black eyes and hair, and rosy cheeks, and the merry expression which was her inheritance from her father.",563
1922,"“This is my little girl Diana,” said Mrs. Barry.",564
1923,"“Diana, you might take Anne out into the garden and show her your flowers.",564
1924,It will be better for you than straining your eyes over that book.,564
1925,"She reads entirely too much--” this to Marilla as the little girls went out--“and I can’t prevent her, for her father aids and abets her.",564
1926,She’s always poring over a book.,564
1927,I’m glad she has the prospect of a playmate--perhaps it will take her more out-of-doors.”,564
1928,"Outside in the garden, which was full of mellow sunset light streaming through the dark old firs to the west of it, stood Anne and Diana, gazing bashfully at each other over a clump of gorgeous tiger lilies.",565
1929,The Barry garden was a bowery wilderness of flowers which would have delighted Anne’s heart at any time less fraught with destiny.,566
1930,"It was encircled by huge old willows and tall firs, beneath which flourished flowers that loved the shade.",566
1931,"Prim, right-angled paths neatly bordered with clamshells, intersected it like moist red ribbons and in the beds between old-fashioned flowers ran riot.",566
1932,"There were rosy bleeding-hearts and great splendid crimson peonies; white, fragrant narcissi and thorny, sweet Scotch roses; pink and blue and white columbines and lilac-tinted Bouncing Bets; clumps of southernwood and ribbon grass and mint; purple Adam-and-Eve, daffodils, and masses of sweet clover white with its delicate, fragrant, feathery sprays; scarlet lightning that shot its fiery lances over prim white musk-flowers; a garden it was where sunshine lingered and bees hummed, and winds, beguiled into loitering, purred and rustled.",566
1933,"“Oh, Diana,” said Anne at last, clasping her hands and speaking almost in a whisper, “oh, do you think you can like me a little--enough to be my bosom friend?”",567
1934,Diana laughed.,568
1935,Diana always laughed before she spoke.,568
1936,"“Why, I guess so,” she said frankly.",569
1937,“I’m awfully glad you’ve come to live at Green Gables.,569
1938,It will be jolly to have somebody to play with.,569
1939,"There isn’t any other girl who lives near enough to play with, and I’ve no sisters big enough.”",569
1940,“Will you swear to be my friend forever and ever?” demanded Anne eagerly.,570
1941,Diana looked shocked.,571
1942,"“Why it’s dreadfully wicked to swear,” she said rebukingly.",572
1943,"“Oh no, not my kind of swearing.",573
1944,"There are two kinds, you know.”",573
1945,"“I never heard of but one kind,” said Diana doubtfully.",574
1946,“There really is another.,575
1947,"Oh, it isn’t wicked at all.",575
1948,It just means vowing and promising solemnly.”,575
1949,"“Well, I don’t mind doing that,” agreed Diana, relieved.",576
1950,“How do you do it?”,576
1951,"“We must join hands--so,” said Anne gravely.",577
1952,“It ought to be over running water.,577
1953,We’ll just imagine this path is running water.,577
1954,I’ll repeat the oath first.,577
1955,"I solemnly swear to be faithful to my bosom friend, Diana Barry, as long as the sun and moon shall endure.",577
1956,Now you say it and put my name in.”,577
1957,Diana repeated the “oath” with a laugh fore and aft.,578
1958,Then she said:,578
1959,"“You’re a queer girl, Anne.",579
1960,I heard before that you were queer.,579
1961,But I believe I’m going to like you real well.”,579
1962,When Marilla and Anne went home Diana went with them as far as the log bridge.,580
1963,The two little girls walked with their arms about each other.,580
1964,At the brook they parted with many promises to spend the next afternoon together.,580
1965,"“Well, did you find Diana a kindred spirit?” asked Marilla as they went up through the garden of Green Gables.",581
1966,"“Oh yes,” sighed Anne, blissfully unconscious of any sarcasm on Marilla’s part.",582
1967,"“Oh Marilla, I’m the happiest girl on Prince Edward Island this very moment.",582
1968,I assure you I’ll say my prayers with a right good-will tonight.,582
1969,Diana and I are going to build a playhouse in Mr. William Bell’s birch grove tomorrow.,582
1970,Can I have those broken pieces of china that are out in the woodshed?,582
1971,Diana’s birthday is in February and mine is in March.,582
1972,Don’t you think that is a very strange coincidence?,582
1973,Diana is going to lend me a book to read.,582
1974,She says it’s perfectly splendid and tremendously exciting.,582
1975,She’s going to show me a place back in the woods where rice lilies grow.,582
1976,Don’t you think Diana has got very soulful eyes?,582
1977,I wish I had soulful eyes.,582
1978,"Diana is going to teach me to sing a song called ‘Nelly in the Hazel Dell.’ She’s going to give me a picture to put up in my room; it’s a perfectly beautiful picture, she says--a lovely lady in a pale blue silk dress.",582
1979,A sewing-machine agent gave it to her.,582
1980,I wish I had something to give Diana.,582
1981,"I’m an inch taller than Diana, but she is ever so much fatter; she says she’d like to be thin because it’s so much more graceful, but I’m afraid she only said it to soothe my feelings.",582
1982,We’re going to the shore some day to gather shells.,582
1983,We have agreed to call the spring down by the log bridge the Dryad’s Bubble.,582
1984,Isn’t that a perfectly elegant name?,582
1985,I read a story once about a spring called that.,582
1986,"A dryad is sort of a grown-up fairy, I think.”",582
1987,"“Well, all I hope is you won’t talk Diana to death,” said Marilla.",583
1988,"“But remember this in all your planning, Anne.",583
1989,You’re not going to play all the time nor most of it.,583
1990,You’ll have your work to do and it’ll have to be done first.”,583
1991,"Anne’s cup of happiness was full, and Matthew caused it to overflow.",584
1992,"He had just got home from a trip to the store at Carmody, and he sheepishly produced a small parcel from his pocket and handed it to Anne, with a deprecatory look at Marilla.",584
1993,"“I heard you say you liked chocolate sweeties, so I got you some,” he said.",585
1994,"“Humph,” sniffed Marilla.",586
1995,“It’ll ruin her teeth and stomach.,586
1996,"There, there, child, don’t look so dismal.",586
1997,"You can eat those, since Matthew has gone and got them.",586
1998,He’d better have brought you peppermints.,586
1999,They’re wholesomer.,586
2000,Don’t sicken yourself eating all them at once now.”,586
2001,"“Oh, no, indeed, I won’t,” said Anne eagerly.",587
2002,"“I’ll just eat one tonight, Marilla.",587
2003,"And I can give Diana half of them, can’t I?",587
2004,The other half will taste twice as sweet to me if I give some to her.,587
2005,It’s delightful to think I have something to give her.”,587
2006,"“I will say it for the child,” said Marilla when Anne had gone to her gable, “she isn’t stingy.",588
2007,"I’m glad, for of all faults I detest stinginess in a child.",588
2008,"Dear me, it’s only three weeks since she came, and it seems as if she’d been here always.",588
2009,I can’t imagine the place without her.,588
2010,"Now, don’t be looking I told-you-so, Matthew.",588
2011,"That’s bad enough in a woman, but it isn’t to be endured in a man.",588
2012,"I’m perfectly willing to own up that I’m glad I consented to keep the child and that I’m getting fond of her, but don’t you rub it in, Matthew Cuthbert.”",588
2013, CHAPTER XIII.,590
2014,The Delights of Anticipation,590
2015," IT’S time Anne was in to do her sewing,” said Marilla, glancing at the clock and then out into the yellow August afternoon where everything drowsed in the heat.",591
