,sentences,paragraph
0,﻿CHAPTER I. Mrs. Rachel Lynde Is Surprised,0
1," MRS. Rachel Lynde lived just where the Avonlea main road dipped down into a little hollow, fringed with alders and ladies’ eardrops and traversed by a brook that had its source away back in the woods of the old Cuthbert place; it was reputed to be an intricate, headlong brook in its earlier course through those woods, with dark secrets of pool and cascade; but by the time it reached Lynde’s Hollow it was a quiet, well-conducted little stream, for not even a brook could run past Mrs. Rachel Lynde’s door without due regard for decency and decorum; it probably was conscious that Mrs. Rachel was sitting at her window, keeping a sharp eye on everything that passed, from brooks and children up, and that if she noticed anything odd or out of place she would never rest until she had ferreted out the whys and wherefores thereof.",1
2,"There are plenty of people, in Avonlea and out of it, who can attend closely to their neighbors’ business by dint of neglecting their own; but Mrs. Rachel Lynde was one of those capable creatures who can manage their own concerns and those of other folks into the bargain.",2
3,"She was a notable housewife; her work was always done and well done; she “ran” the Sewing Circle, helped run the Sunday-school, and was the strongest prop of the Church Aid Society and Foreign Missions Auxiliary.",2
4,"Yet with all this Mrs. Rachel found abundant time to sit for hours at her kitchen window, knitting “cotton warp” quilts--she had knitted sixteen of them, as Avonlea housekeepers were wont to tell in awed voices--and keeping a sharp eye on the main road that crossed the hollow and wound up the steep red hill beyond.",2
5,"Since Avonlea occupied a little triangular peninsula jutting out into the Gulf of St. Lawrence, with water on two sides of it, anybody who went out of it or into it had to pass over that hill road and so run the unseen gauntlet of Mrs. Rachel’s all-seeing eye.",2
6,She was sitting there one afternoon in early June.,3
7,"The sun was coming in at the window warm and bright; the orchard on the slope below the house was in a bridal flush of pinky-white bloom, hummed over by a myriad of bees.",3
8,Thomas Lynde--a meek little man whom Avonlea people called “Rachel Lynde’s husband”--was sowing his late turnip seed on the hill field beyond the barn; and Matthew Cuthbert ought to have been sowing his on the big red brook field away over by Green Gables.,3
9,Mrs. Rachel knew that he ought because she had heard him tell Peter Morrison the evening before in William J. Blair’s store over at Carmody that he meant to sow his turnip seed the next afternoon.,3
10,"Peter had asked him, of course, for Matthew Cuthbert had never been known to volunteer information about anything in his whole life.",3
11,"And yet here was Matthew Cuthbert, at half-past three on the afternoon of a busy day, placidly driving over the hollow and up the hill; moreover, he wore a white collar and his best suit of clothes, which was plain proof that he was going out of Avonlea; and he had the buggy and the sorrel mare, which betokened that he was going a considerable distance.",4
12,"Now, where was Matthew Cuthbert going and why was he going there?",4
13,"Had it been any other man in Avonlea, Mrs. Rachel, deftly putting this and that together, might have given a pretty good guess as to both questions.",5
14,But Matthew so rarely went from home that it must be something pressing and unusual which was taking him; he was the shyest man alive and hated to have to go among strangers or to any place where he might have to talk.,5
15,"Matthew, dressed up with a white collar and driving in a buggy, was something that didn’t happen often.",5
16,"Mrs. Rachel, ponder as she might, could make nothing of it and her afternoon’s enjoyment was spoiled.",5
17,"“I’ll just step over to Green Gables after tea and find out from Marilla where he’s gone and why,” the worthy woman finally concluded.",6
18,“He doesn’t generally go to town this time of year and he _never_ visits; if he’d run out of turnip seed he wouldn’t dress up and take the buggy to go for more; he wasn’t driving fast enough to be going for a doctor.,6
19,Yet something must have happened since last night to start him off.,6
20,"I’m clean puzzled, that’s what, and I won’t know a minute’s peace of mind or conscience until I know what has taken Matthew Cuthbert out of Avonlea today.”",6
21,"Accordingly after tea Mrs. Rachel set out; she had not far to go; the big, rambling, orchard-embowered house where the Cuthberts lived was a scant quarter of a mile up the road from Lynde’s Hollow.",7
22,"To be sure, the long lane made it a good deal further.",7
23,"Matthew Cuthbert’s father, as shy and silent as his son after him, had got as far away as he possibly could from his fellow men without actually retreating into the woods when he founded his homestead.",7
24,"Green Gables was built at the furthest edge of his cleared land and there it was to this day, barely visible from the main road along which all the other Avonlea houses were so sociably situated.",7
25,Mrs. Rachel Lynde did not call living in such a place _living_ at all.,7
26,"“It’s just _staying_, that’s what,” she said as she stepped along the deep-rutted, grassy lane bordered with wild rose bushes.",8
27,"“It’s no wonder Matthew and Marilla are both a little odd, living away back here by themselves.",8
28,"Trees aren’t much company, though dear knows if they were there’d be enough of them.",8
29,I’d ruther look at people.,8
30,"To be sure, they seem contented enough; but then, I suppose, they’re used to it.",8
31,"A body can get used to anything, even to being hanged, as the Irishman said.”",8
32,With this Mrs. Rachel stepped out of the lane into the backyard of Green Gables.,9
33,"Very green and neat and precise was that yard, set about on one side with great patriarchal willows and on the other with prim Lombardies.",9
34,"Not a stray stick nor stone was to be seen, for Mrs. Rachel would have seen it if there had been.",9
35,Privately she was of the opinion that Marilla Cuthbert swept that yard over as often as she swept her house.,9
36,One could have eaten a meal off the ground without overbrimming the proverbial peck of dirt.,9
37,Mrs. Rachel rapped smartly at the kitchen door and stepped in when bidden to do so.,10
38,The kitchen at Green Gables was a cheerful apartment--or would have been cheerful if it had not been so painfully clean as to give it something of the appearance of an unused parlor.,10
39,"Its windows looked east and west; through the west one, looking out on the back yard, came a flood of mellow June sunlight; but the east one, whence you got a glimpse of the bloom white cherry-trees in the left orchard and nodding, slender birches down in the hollow by the brook, was greened over by a tangle of vines.",10
40,"Here sat Marilla Cuthbert, when she sat at all, always slightly distrustful of sunshine, which seemed to her too dancing and irresponsible a thing for a world which was meant to be taken seriously; and here she sat now, knitting, and the table behind her was laid for supper.",10
41,"Mrs. Rachel, before she had fairly closed the door, had taken a mental note of everything that was on that table.",11
42,"There were three plates laid, so that Marilla must be expecting some one home with Matthew to tea; but the dishes were everyday dishes and there was only crab-apple preserves and one kind of cake, so that the expected company could not be any particular company.",11
43,Yet what of Matthew’s white collar and the sorrel mare?,11
44,"Mrs. Rachel was getting fairly dizzy with this unusual mystery about quiet, unmysterious Green Gables.",11
45,"“Good evening, Rachel,” Marilla said briskly.",12
46,"“This is a real fine evening, isn’t it?",12
47,Won’t you sit down?,12
48,How are all your folks?”,12
49,"Something that for lack of any other name might be called friendship existed and always had existed between Marilla Cuthbert and Mrs. Rachel, in spite of--or perhaps because of--their dissimilarity.",13
50,"Marilla was a tall, thin woman, with angles and without curves; her dark hair showed some gray streaks and was always twisted up in a hard little knot behind with two wire hairpins stuck aggressively through it.",14
51,"She looked like a woman of narrow experience and rigid conscience, which she was; but there was a saving something about her mouth which, if it had been ever so slightly developed, might have been considered indicative of a sense of humor.",14
52,"“We’re all pretty well,” said Mrs. Rachel.",15
53,"“I was kind of afraid _you_ weren’t, though, when I saw Matthew starting off today.",15
54,I thought maybe he was going to the doctor’s.”,15
55,Marilla’s lips twitched understandingly.,16
56,She had expected Mrs. Rachel up; she had known that the sight of Matthew jaunting off so unaccountably would be too much for her neighbor’s curiosity.,16
57,"“Oh, no, I’m quite well although I had a bad headache yesterday,” she said.",17
58,“Matthew went to Bright River.,17
59,We’re getting a little boy from an orphan asylum in Nova Scotia and he’s coming on the train tonight.”,17
60,If Marilla had said that Matthew had gone to Bright River to meet a kangaroo from Australia Mrs. Rachel could not have been more astonished.,18
61,She was actually stricken dumb for five seconds.,18
62,"It was unsupposable that Marilla was making fun of her, but Mrs. Rachel was almost forced to suppose it.",18
63,"“Are you in earnest, Marilla?” she demanded when voice returned to her.",19
64,"“Yes, of course,” said Marilla, as if getting boys from orphan asylums in Nova Scotia were part of the usual spring work on any well-regulated Avonlea farm instead of being an unheard of innovation.",20
65,Mrs. Rachel felt that she had received a severe mental jolt.,21
66,She thought in exclamation points.,21
67,A boy!,21
68,Marilla and Matthew Cuthbert of all people adopting a boy!,21
69,From an orphan asylum!,21
70,"Well, the world was certainly turning upside down!",21
71,She would be surprised at nothing after this!,21
72,Nothing!,21
73,“What on earth put such a notion into your head?” she demanded disapprovingly.,22
74,"This had been done without her advice being asked, and must perforce be disapproved.",23
75,"“Well, we’ve been thinking about it for some time--all winter in fact,”  returned Marilla.",24
76,“Mrs.,24
77,Alexander Spencer was up here one day before Christmas and she said she was going to get a little girl from the asylum over in Hopeton in the spring.,24
78,Her cousin lives there and Mrs. Spencer has visited her and knows all about it.,24
79,So Matthew and I have talked it over off and on ever since.,24
80,We thought we’d get a boy.,24
81,"Matthew is getting up in years, you know--he’s sixty--and he isn’t so spry as he once was.",24
82,His heart troubles him a good deal.,24
83,And you know how desperate hard it’s got to be to get hired help.,24
84,"There’s never anybody to be had but those stupid, half-grown little French boys; and as soon as you do get one broke into your ways and taught something he’s up and off to the lobster canneries or the States.",24
85,At first Matthew suggested getting a Home boy.,24
86,But I said ‘no’ flat to that.,24
87,"‘They may be all right--I’m not saying they’re not--but no London street Arabs for me,’ I said.",24
88,‘Give me a native born at least.,24
89,"There’ll be a risk, no matter who we get.",24
90,But I’ll feel easier in my mind and sleep sounder at nights if we get a born Canadian.’ So in the end we decided to ask Mrs. Spencer to pick us out one when she went over to get her little girl.,24
91,"We heard last week she was going, so we sent her word by Richard Spencer’s folks at Carmody to bring us a smart, likely boy of about ten or eleven.",24
92,We decided that would be the best age--old enough to be of some use in doing chores right off and young enough to be trained up proper.,24
93,We mean to give him a good home and schooling.,24
94,We had a telegram from Mrs. Alexander Spencer today--the mail-man brought it from the station--saying they were coming on the five-thirty train tonight.,24
95,So Matthew went to Bright River to meet him.,24
96,Mrs. Spencer will drop him off there.,24
97,Of course she goes on to White Sands station herself.”,24
98,"Mrs. Rachel prided herself on always speaking her mind; she proceeded to speak it now, having adjusted her mental attitude to this amazing piece of news.",25
99,"“Well, Marilla, I’ll just tell you plain that I think you’re doing a mighty foolish thing--a risky thing, that’s what.",26
100,You don’t know what you’re getting.,26
101,You’re bringing a strange child into your house and home and you don’t know a single thing about him nor what his disposition is like nor what sort of parents he had nor how he’s likely to turn out.,26
102,"Why, it was only last week I read in the paper how a man and his wife up west of the Island took a boy out of an orphan asylum and he set fire to the house at night--set it _on purpose_, Marilla--and nearly burnt them to a crisp in their beds.",26
103,And I know another case where an adopted boy used to suck the eggs--they couldn’t break him of it.,26
104,"If you had asked my advice in the matter--which you didn’t do, Marilla--I’d have said for mercy’s sake not to think of such a thing, that’s what.”",26
105,This Job’s comforting seemed neither to offend nor to alarm Marilla.,27
106,She knitted steadily on.,27
107,"“I don’t deny there’s something in what you say, Rachel.",28
108,I’ve had some qualms myself.,28
109,But Matthew was terrible set on it.,28
110,"I could see that, so I gave in.",28
111,It’s so seldom Matthew sets his mind on anything that when he does I always feel it’s my duty to give in.,28
112,"And as for the risk, there’s risks in pretty near everything a body does in this world.",28
113,There’s risks in people’s having children of their own if it comes to that--they don’t always turn out well.,28
114,And then Nova Scotia is right close to the Island.,28
115,It isn’t as if we were getting him from England or the States.,28
116,He can’t be much different from ourselves.”,28
117,"“Well, I hope it will turn out all right,” said Mrs. Rachel in a tone that plainly indicated her painful doubts.",29
118,“Only don’t say I didn’t warn you if he burns Green Gables down or puts strychnine in the well--I heard of a case over in New Brunswick where an orphan asylum child did that and the whole family died in fearful agonies.,29
119,"Only, it was a girl in that instance.”",29
120,"“Well, we’re not getting a girl,” said Marilla, as if poisoning wells were a purely feminine accomplishment and not to be dreaded in the case of a boy.",30
121,“I’d never dream of taking a girl to bring up.,30
122,I wonder at Mrs. Alexander Spencer for doing it.,30
123,"But there, _she_ wouldn’t shrink from adopting a whole orphan asylum if she took it into her head.”",30
124,Mrs. Rachel would have liked to stay until Matthew came home with his imported orphan.,31
125,But reflecting that it would be a good two hours at least before his arrival she concluded to go up the road to Robert Bell’s and tell the news.,31
126,"It would certainly make a sensation second to none, and Mrs. Rachel dearly loved to make a sensation.",31
127,"So she took herself away, somewhat to Marilla’s relief, for the latter felt her doubts and fears reviving under the influence of Mrs. Rachel’s pessimism.",31
128,"“Well, of all things that ever were or will be!” ejaculated Mrs. Rachel when she was safely out in the lane.",32
129,“It does really seem as if I must be dreaming.,32
130,"Well, I’m sorry for that poor young one and no mistake.",32
131,"Matthew and Marilla don’t know anything about children and they’ll expect him to be wiser and steadier than his own grandfather, if so be’s he ever had a grandfather, which is doubtful.",32
132,"It seems uncanny to think of a child at Green Gables somehow; there’s never been one there, for Matthew and Marilla were grown up when the new house was built--if they ever _were_ children, which is hard to believe when one looks at them.",32
133,I wouldn’t be in that orphan’s shoes for anything.,32
134,"My, but I pity him, that’s what.”",32
135,So said Mrs. Rachel to the wild rose bushes out of the fulness of her heart; but if she could have seen the child who was waiting patiently at the Bright River station at that very moment her pity would have been still deeper and more profound.,33
136, CHAPTER II.,35
137,Matthew Cuthbert Is Surprised,35
138, MATTHEW Cuthbert and the sorrel mare jogged comfortably over the eight miles to Bright River.,36
139,"It was a pretty road, running along between snug farmsteads, with now and again a bit of balsamy fir wood to drive through or a hollow where wild plums hung out their filmy bloom.",36
140,The air was sweet with the breath of many apple orchards and the meadows sloped away in the distance to horizon mists of pearl and purple; while,36
141,     “The little birds sang as if it were      The one day of summer in all the year.”,37
142,"Matthew enjoyed the drive after his own fashion, except during the moments when he met women and had to nod to them--for in Prince Edward Island you are supposed to nod to all and sundry you meet on the road whether you know them or not.",38
143,Matthew dreaded all women except Marilla and Mrs. Rachel; he had an uncomfortable feeling that the mysterious creatures were secretly laughing at him.,39
144,"He may have been quite right in thinking so, for he was an odd-looking personage, with an ungainly figure and long iron-gray hair that touched his stooping shoulders, and a full, soft brown beard which he had worn ever since he was twenty.",39
145,"In fact, he had looked at twenty very much as he looked at sixty, lacking a little of the grayness.",39
146,"When he reached Bright River there was no sign of any train; he thought he was too early, so he tied his horse in the yard of the small Bright River hotel and went over to the station house.",40
147,The long platform was almost deserted; the only living creature in sight being a girl who was sitting on a pile of shingles at the extreme end.,40
148,"Matthew, barely noting that it _was_ a girl, sidled past her as quickly as possible without looking at her.",40
149,Had he looked he could hardly have failed to notice the tense rigidity and expectation of her attitude and expression.,40
150,"She was sitting there waiting for something or somebody and, since sitting and waiting was the only thing to do just then, she sat and waited with all her might and main.",40
151,"Matthew encountered the stationmaster locking up the ticket office preparatory to going home for supper, and asked him if the five-thirty train would soon be along.",41
152,"“The five-thirty train has been in and gone half an hour ago,” answered that brisk official.",42
153,“But there was a passenger dropped off for you--a little girl.,42
154,She’s sitting out there on the shingles.,42
155,"I asked her to go into the ladies’ waiting room, but she informed me gravely that she preferred to stay outside.",42
156,"‘There was more scope for imagination,’ she said.",42
157,"She’s a case, I should say.”",42
158,"“I’m not expecting a girl,” said Matthew blankly.",43
159,“It’s a boy I’ve come for.,43
160,He should be here.,43
161,Mrs. Alexander Spencer was to bring him over from Nova Scotia for me.”,43
162,The stationmaster whistled.,44
163,"“Guess there’s some mistake,” he said.",45
164,“Mrs.,45
165,Spencer came off the train with that girl and gave her into my charge.,45
166,Said you and your sister were adopting her from an orphan asylum and that you would be along for her presently.,45
167,That’s all I know about it--and I haven’t got any more orphans concealed hereabouts.”,45
168,"“I don’t understand,” said Matthew helplessly, wishing that Marilla was at hand to cope with the situation.",46
169,"“Well, you’d better question the girl,” said the stationmaster carelessly.",47
170,"“I dare say she’ll be able to explain--she’s got a tongue of her own, that’s certain.",47
171,Maybe they were out of boys of the brand you wanted.”,47
172,"He walked jauntily away, being hungry, and the unfortunate Matthew was left to do that which was harder for him than bearding a lion in its den--walk up to a girl--a strange girl--an orphan girl--and demand of her why she wasn’t a boy.",48
173,Matthew groaned in spirit as he turned about and shuffled gently down the platform towards her.,48
174,She had been watching him ever since he had passed her and she had her eyes on him now.,49
175,"Matthew was not looking at her and would not have seen what she was really like if he had been, but an ordinary observer would have seen this: A child of about eleven, garbed in a very short, very tight, very ugly dress of yellowish-gray wincey.",49
176,"She wore a faded brown sailor hat and beneath the hat, extending down her back, were two braids of very thick, decidedly red hair.",49
177,"Her face was small, white and thin, also much freckled; her mouth was large and so were her eyes, which looked green in some lights and moods and gray in others.",49
178,"So far, the ordinary observer; an extraordinary observer might have seen that the chin was very pointed and pronounced; that the big eyes were full of spirit and vivacity; that the mouth was sweet-lipped and expressive; that the forehead was broad and full; in short, our discerning extraordinary observer might have concluded that no commonplace soul inhabited the body of this stray woman-child of whom shy Matthew Cuthbert was so ludicrously afraid.",50
179,"Matthew, however, was spared the ordeal of speaking first, for as soon as she concluded that he was coming to her she stood up, grasping with one thin brown hand the handle of a shabby, old-fashioned carpet-bag; the other she held out to him.",51
180,"“I suppose you are Mr. Matthew Cuthbert of Green Gables?” she said in a peculiarly clear, sweet voice.",52
181,“I’m very glad to see you.,52
182,I was beginning to be afraid you weren’t coming for me and I was imagining all the things that might have happened to prevent you.,52
183,"I had made up my mind that if you didn’t come for me tonight I’d go down the track to that big wild cherry-tree at the bend, and climb up into it to stay all night.",52
184,"I wouldn’t be a bit afraid, and it would be lovely to sleep in a wild cherry-tree all white with bloom in the moonshine, don’t you think?",52
185,"You could imagine you were dwelling in marble halls, couldn’t you?",52
186,"And I was quite sure you would come for me in the morning, if you didn’t tonight.”",52
187,Matthew had taken the scrawny little hand awkwardly in his; then and there he decided what to do.,53
188,He could not tell this child with the glowing eyes that there had been a mistake; he would take her home and let Marilla do that.,53
189,"She couldn’t be left at Bright River anyhow, no matter what mistake had been made, so all questions and explanations might as well be deferred until he was safely back at Green Gables.",53
190,"“I’m sorry I was late,” he said shyly.",54
191,“Come along.,54
192,The horse is over in the yard.,54
193,Give me your bag.”,54
194,"“Oh, I can carry it,” the child responded cheerfully.",55
195,“It isn’t heavy.,55
196,"I’ve got all my worldly goods in it, but it isn’t heavy.",55
197,And if it isn’t carried in just a certain way the handle pulls out--so I’d better keep it because I know the exact knack of it.,55
198,It’s an extremely old carpet-bag.,55
199,"Oh, I’m very glad you’ve come, even if it would have been nice to sleep in a wild cherry-tree.",55
200,"We’ve got to drive a long piece, haven’t we?",55
201,Mrs. Spencer said it was eight miles.,55
202,I’m glad because I love driving.,55
203,"Oh, it seems so wonderful that I’m going to live with you and belong to you.",55
204,I’ve never belonged to anybody--not really.,55
205,But the asylum was the worst.,55
206,"I’ve only been in it four months, but that was enough.",55
207,"I don’t suppose you ever were an orphan in an asylum, so you can’t possibly understand what it is like.",55
208,It’s worse than anything you could imagine.,55
209,"Mrs. Spencer said it was wicked of me to talk like that, but I didn’t mean to be wicked.",55
210,"It’s so easy to be wicked without knowing it, isn’t it?",55
211,"They were good, you know--the asylum people.",55
212,But there is so little scope for the imagination in an asylum--only just in the other orphans.,55
213,"It was pretty interesting to imagine things about them--to imagine that perhaps the girl who sat next to you was really the daughter of a belted earl, who had been stolen away from her parents in her infancy by a cruel nurse who died before she could confess.",55
214,"I used to lie awake at nights and imagine things like that, because I didn’t have time in the day.",55
215,"I guess that’s why I’m so thin--I _am_ dreadful thin, ain’t I?",55
216,There isn’t a pick on my bones.,55
217,"I do love to imagine I’m nice and plump, with dimples in my elbows.”",55
218,"With this Matthew’s companion stopped talking, partly because she was out of breath and partly because they had reached the buggy.",56
