,sentences,paragraph
3428,"Matthew understands me, and it’s so nice to be understood, Marilla.”",995
3429,Anne was too excited to do herself justice as to lessons that morning in school.,996
3430,Gilbert Blythe spelled her down in class and left her clear out of sight in mental arithmetic.,996
3431,"Anne’s consequent humiliation was less than it might have been, however, in view of the concert and the spare-room bed.",996
3432,She and Diana talked so constantly about it all day that with a stricter teacher than Mr. Phillips dire disgrace must inevitably have been their portion.,996
3433,"Anne felt that she could not have borne it if she had not been going to the concert, for nothing else was discussed that day in school.",997
3434,"The Avonlea Debating Club, which met fortnightly all winter, had had several smaller free entertainments; but this was to be a big affair, admission ten cents, in aid of the library.",997
3435,"The Avonlea young people had been practicing for weeks, and all the scholars were especially interested in it by reason of older brothers and sisters who were going to take part.",997
3436,"Everybody in school over nine years of age expected to go, except Carrie Sloane, whose father shared Marilla’s opinions about small girls going out to night concerts.",997
3437,Carrie Sloane cried into her grammar all the afternoon and felt that life was not worth living.,997
3438,For Anne the real excitement began with the dismissal of school and increased therefrom in crescendo until it reached to a crash of positive ecstasy in the concert itself.,998
3439,They had a “perfectly elegant tea;” and then came the delicious occupation of dressing in Diana’s little room upstairs.,998
3440,Diana did Anne’s front hair in the new pompadour style and Anne tied Diana’s bows with the especial knack she possessed; and they experimented with at least half a dozen different ways of arranging their back hair.,998
3441,"At last they were ready, cheeks scarlet and eyes glowing with excitement.",998
3442,"True, Anne could not help a little pang when she contrasted her plain black tam and shapeless, tight-sleeved, homemade gray-cloth coat with Diana’s jaunty fur cap and smart little jacket.",999
3443,But she remembered in time that she had an imagination and could use it.,999
3444,"Then Diana’s cousins, the Murrays from Newbridge, came; they all crowded into the big pung sleigh, among straw and furry robes.",1000
3445,"Anne reveled in the drive to the hall, slipping along over the satin-smooth roads with the snow crisping under the runners.",1000
3446,"There was a magnificent sunset, and the snowy hills and deep-blue water of the St. Lawrence Gulf seemed to rim in the splendor like a huge bowl of pearl and sapphire brimmed with wine and fire.",1000
3447,"Tinkles of sleigh bells and distant laughter, that seemed like the mirth of wood elves, came from every quarter.",1000
3448,"“Oh, Diana,” breathed Anne, squeezing Diana’s mittened hand under the fur robe, “isn’t it all like a beautiful dream?",1001
3449,Do I really look the same as usual?,1001
3450,I feel so different that it seems to me it must show in my looks.”,1001
3451,"“You look awfully nice,” said Diana, who having just received a compliment from one of her cousins, felt that she ought to pass it on.",1002
3452,“You’ve got the loveliest color.”,1002
3453,"The program that night was a series of “thrills” for at least one listener in the audience, and, as Anne assured Diana, every succeeding thrill was thrillier than the last.",1003
3454,"When Prissy Andrews, attired in a new pink-silk waist with a string of pearls about her smooth white throat and real carnations in her hair--rumor whispered that the master had sent all the way to town for them for her--“climbed the slimy ladder, dark without one ray of light,” Anne shivered in luxurious sympathy; when the choir sang “Far Above the Gentle Daisies” Anne gazed at the ceiling as if it were frescoed with angels; when Sam Sloane proceeded to explain and illustrate “How Sockery Set a Hen” Anne laughed until people sitting near her laughed too, more out of sympathy with her than with amusement at a selection that was rather threadbare even in Avonlea; and when Mr. Phillips gave Mark Antony’s oration over the dead body of Cæsar in the most heart-stirring tones--looking at Prissy Andrews at the end of every sentence--Anne felt that she could rise and mutiny on the spot if but one Roman citizen led the way.",1003
3455,Only one number on the program failed to interest her.,1004
3456,"When Gilbert Blythe recited “Bingen on the Rhine” Anne picked up Rhoda Murray’s library book and read it until he had finished, when she sat rigidly stiff and motionless while Diana clapped her hands until they tingled.",1004
3457,"It was eleven when they got home, sated with dissipation, but with the exceeding sweet pleasure of talking it all over still to come.",1005
3458,Everybody seemed asleep and the house was dark and silent.,1005
3459,"Anne and Diana tiptoed into the parlor, a long narrow room out of which the spare room opened.",1005
3460,It was pleasantly warm and dimly lighted by the embers of a fire in the grate.,1005
3461,"“Let’s undress here,” said Diana.",1006
3462,“It’s so nice and warm.”,1006
3463,“Hasn’t it been a delightful time?” sighed Anne rapturously.,1007
3464,“It must be splendid to get up and recite there.,1007
3465,"Do you suppose we will ever be asked to do it, Diana?”",1007
3466,"“Yes, of course, someday.",1008
3467,They’re always wanting the big scholars to recite.,1008
3468,Gilbert Blythe does often and he’s only two years older than us.,1008
3469,"Oh, Anne, how could you pretend not to listen to him?",1008
3470,"When he came to the line,",1008
3471,"           ‘There’s Another, _not_ a sister,’",1009
3472,he looked right down at you.”,1010
3473,"“Diana,” said Anne with dignity, “you are my bosom friend, but I cannot allow even you to speak to me of that person.",1011
3474,Are you ready for bed?,1011
3475,Let’s run a race and see who’ll get to the bed first.”,1011
3476,The suggestion appealed to Diana.,1012
3477,"The two little white-clad figures flew down the long room, through the spare-room door, and bounded on the bed at the same moment.",1012
3478,"And then--something--moved beneath them, there was a gasp and a cry--and somebody said in muffled accents:",1012
3479,“Merciful goodness!”,1013
3480,Anne and Diana were never able to tell just how they got off that bed and out of the room.,1014
3481,They only knew that after one frantic rush they found themselves tiptoeing shiveringly upstairs.,1014
3482,"“Oh, who was it--_what_ was it?” whispered Anne, her teeth chattering with cold and fright.",1015
3483,"“It was Aunt Josephine,” said Diana, gasping with laughter.",1016
3484,"“Oh, Anne, it was Aunt Josephine, however she came to be there.",1016
3485,"Oh, and I know she will be furious.",1016
3486,"It’s dreadful--it’s really dreadful--but did you ever know anything so funny, Anne?”",1016
3487,“Who is your Aunt Josephine?”,1017
3488,“She’s father’s aunt and she lives in Charlottetown.,1018
3489,She’s awfully old--seventy anyhow--and I don’t believe she was _ever_ a little girl.,1018
3490,"We were expecting her out for a visit, but not so soon.",1018
3491,"She’s awfully prim and proper and she’ll scold dreadfully about this, I know.",1018
3492,"Well, we’ll have to sleep with Minnie May--and you can’t think how she kicks.”",1018
3493,Miss Josephine Barry did not appear at the early breakfast the next morning.,1019
3494,Mrs. Barry smiled kindly at the two little girls.,1019
3495,“Did you have a good time last night?,1020
3496,"I tried to stay awake until you came home, for I wanted to tell you Aunt Josephine had come and that you would have to go upstairs after all, but I was so tired I fell asleep.",1020
3497,"I hope you didn’t disturb your aunt, Diana.”",1020
3498,"Diana preserved a discreet silence, but she and Anne exchanged furtive smiles of guilty amusement across the table.",1021
3499,"Anne hurried home after breakfast and so remained in blissful ignorance of the disturbance which presently resulted in the Barry household until the late afternoon, when she went down to Mrs. Lynde’s on an errand for Marilla.",1021
3500,"“So you and Diana nearly frightened poor old Miss Barry to death last night?” said Mrs. Lynde severely, but with a twinkle in her eye.",1022
3501,“Mrs.,1022
3502,Barry was here a few minutes ago on her way to Carmody.,1022
3503,She’s feeling real worried over it.,1022
3504,"Old Miss Barry was in a terrible temper when she got up this morning--and Josephine Barry’s temper is no joke, I can tell you that.",1022
3505,She wouldn’t speak to Diana at all.”,1022
3506,"“It wasn’t Diana’s fault,” said Anne contritely.",1023
3507,“It was mine.,1023
3508,I suggested racing to see who would get into bed first.”,1023
3509,"“I knew it!” said Mrs. Lynde, with the exultation of a correct guesser.",1024
3510,“I knew that idea came out of your head.,1024
3511,"Well, it’s made a nice lot of trouble, that’s what.",1024
3512,"Old Miss Barry came out to stay for a month, but she declares she won’t stay another day and is going right back to town tomorrow, Sunday and all as it is.",1024
3513,She’d have gone today if they could have taken her.,1024
3514,"She had promised to pay for a quarter’s music lessons for Diana, but now she is determined to do nothing at all for such a tomboy.",1024
3515,"Oh, I guess they had a lively time of it there this morning.",1024
3516,The Barrys must feel cut up.,1024
3517,Old Miss Barry is rich and they’d like to keep on the good side of her.,1024
3518,"Of course, Mrs. Barry didn’t say just that to me, but I’m a pretty good judge of human nature, that’s what.”",1024
3519,"“I’m such an unlucky girl,” mourned Anne.",1025
3520,“I’m always getting into scrapes myself and getting my best friends--people I’d shed my heart’s blood for--into them too.,1025
3521,"Can you tell me why it is so, Mrs. Lynde?”",1025
3522,"“It’s because you’re too heedless and impulsive, child, that’s what.",1026
3523,You never stop to think--whatever comes into your head to say or do you say or do it without a moment’s reflection.”,1026
3524,"“Oh, but that’s the best of it,” protested Anne.",1027
3525,"“Something just flashes into your mind, so exciting, and you must out with it.",1027
3526,If you stop to think it over you spoil it all.,1027
3527,"Haven’t you never felt that yourself, Mrs. Lynde?”",1027
3528,"No, Mrs. Lynde had not.",1028
3529,She shook her head sagely.,1028
3530,"“You must learn to think a little, Anne, that’s what.",1029
3531,The proverb you need to go by is ‘Look before you leap’--especially into spare-room beds.”,1029
3532,"Mrs. Lynde laughed comfortably over her mild joke, but Anne remained pensive.",1030
3533,"She saw nothing to laugh at in the situation, which to her eyes appeared very serious.",1030
3534,When she left Mrs. Lynde’s she took her way across the crusted fields to Orchard Slope.,1030
3535,Diana met her at the kitchen door.,1030
3536,"“Your Aunt Josephine was very cross about it, wasn’t she?” whispered Anne.",1031
3537,"“Yes,” answered Diana, stifling a giggle with an apprehensive glance over her shoulder at the closed sitting-room door.",1032
3538,"“She was fairly dancing with rage, Anne.",1032
3539,"Oh, how she scolded.",1032
3540,She said I was the worst-behaved girl she ever saw and that my parents ought to be ashamed of the way they had brought me up.,1032
3541,She says she won’t stay and I’m sure I don’t care.,1032
3542,But Father and Mother do.”,1032
3543,“Why didn’t you tell them it was my fault?” demanded Anne.,1033
3544,"“It’s likely I’d do such a thing, isn’t it?” said Diana with just scorn.",1034
3545,"“I’m no telltale, Anne Shirley, and anyhow I was just as much to blame as you.”",1034
3546,"“Well, I’m going in to tell her myself,” said Anne resolutely.",1035
3547,Diana stared.,1036
3548,"“Anne Shirley, you’d never!",1037
3549,why--she’ll eat you alive!”,1037
3550,"“Don’t frighten me any more than I am frightened,” implored Anne.",1038
3551,“I’d rather walk up to a cannon’s mouth.,1038
3552,"But I’ve got to do it, Diana.",1038
3553,It was my fault and I’ve got to confess.,1038
3554,"I’ve had practice in confessing, fortunately.”",1038
3555,"“Well, she’s in the room,” said Diana.",1039
3556,“You can go in if you want to.,1039
3557,I wouldn’t dare.,1039
3558,And I don’t believe you’ll do a bit of good.”,1039
3559,"With this encouragement Anne bearded the lion in its den--that is to say, walked resolutely up to the sitting-room door and knocked faintly.",1040
3560,A sharp “Come in” followed.,1040
3561,"Miss Josephine Barry, thin, prim, and rigid, was knitting fiercely by the fire, her wrath quite unappeased and her eyes snapping through her gold-rimmed glasses.",1041
3562,"She wheeled around in her chair, expecting to see Diana, and beheld a white-faced girl whose great eyes were brimmed up with a mixture of desperate courage and shrinking terror.",1041
3563,"“Who are you?” demanded Miss Josephine Barry, without ceremony.",1042
3564,"“I’m Anne of Green Gables,” said the small visitor tremulously, clasping her hands with her characteristic gesture, “and I’ve come to confess, if you please.”",1043
3565,“Confess what?”,1044
3566,“That it was all my fault about jumping into bed on you last night.,1045
3567,I suggested it.,1045
3568,"Diana would never have thought of such a thing, I am sure.",1045
3569,"Diana is a very ladylike girl, Miss Barry.",1045
3570,So you must see how unjust it is to blame her.”,1045
3571,"“Oh, I must, hey?",1046
3572,I rather think Diana did her share of the jumping at least.,1046
3573,Such carryings on in a respectable house!”,1046
3574,"“But we were only in fun,” persisted Anne.",1047
3575,"“I think you ought to forgive us, Miss Barry, now that we’ve apologized.",1047
3576,"And anyhow, please forgive Diana and let her have her music lessons.",1047
3577,"Diana’s heart is set on her music lessons, Miss Barry, and I know too well what it is to set your heart on a thing and not get it.",1047
3578,"If you must be cross with anyone, be cross with me.",1047
3579,I’ve been so used in my early days to having people cross at me that I can endure it much better than Diana can.”,1047
3580,Much of the snap had gone out of the old lady’s eyes by this time and was replaced by a twinkle of amused interest.,1048
3581,But she still said severely:,1048
3582,“I don’t think it is any excuse for you that you were only in fun.,1049
3583,Little girls never indulged in that kind of fun when I was young.,1049
3584,"You don’t know what it is to be awakened out of a sound sleep, after a long and arduous journey, by two great girls coming bounce down on you.”",1049
3585,"“I don’t _know_, but I can _imagine_,” said Anne eagerly.",1050
3586,“I’m sure it must have been very disturbing.,1050
3587,"But then, there is our side of it too.",1050
3588,"Have you any imagination, Miss Barry?",1050
3589,"If you have, just put yourself in our place.",1050
3590,We didn’t know there was anybody in that bed and you nearly scared us to death.,1050
3591,It was simply awful the way we felt.,1050
3592,And then we couldn’t sleep in the spare room after being promised.,1050
3593,I suppose you are used to sleeping in spare rooms.,1050
3594,But just imagine what you would feel like if you were a little orphan girl who had never had such an honor.”,1050
3595,All the snap had gone by this time.,1051
3596,"Miss Barry actually laughed--a sound which caused Diana, waiting in speechless anxiety in the kitchen outside, to give a great gasp of relief.",1051
3597,"“I’m afraid my imagination is a little rusty--it’s so long since I used it,” she said.",1052
3598,“I dare say your claim to sympathy is just as strong as mine.,1052
3599,It all depends on the way we look at it.,1052
3600,Sit down here and tell me about yourself.”,1052
3601,"“I am very sorry I can’t,” said Anne firmly.",1053
3602,"“I would like to, because you seem like an interesting lady, and you might even be a kindred spirit although you don’t look very much like it.",1053
3603,But it is my duty to go home to Miss Marilla Cuthbert.,1053
3604,Miss Marilla Cuthbert is a very kind lady who has taken me to bring up properly.,1053
3605,"She is doing her best, but it is very discouraging work.",1053
3606,You must not blame her because I jumped on the bed.,1053
3607,But before I go I do wish you would tell me if you will forgive Diana and stay just as long as you meant to in Avonlea.”,1053
3608,"“I think perhaps I will if you will come over and talk to me occasionally,” said Miss Barry.",1054
3609,That evening Miss Barry gave Diana a silver bangle bracelet and told the senior members of the household that she had unpacked her valise.,1055
3610,"“I’ve made up my mind to stay simply for the sake of getting better acquainted with that Anne-girl,” she said frankly.",1056
3611,"“She amuses me, and at my time of life an amusing person is a rarity.”",1056
3612,"Marilla’s only comment when she heard the story was, “I told you so.”  This was for Matthew’s benefit.",1057
3613,Miss Barry stayed her month out and over.,1058
3614,"She was a more agreeable guest than usual, for Anne kept her in good humor.",1058
3615,They became firm friends.,1058
3616,When Miss Barry went away she said:,1059
3617,"“Remember, you Anne-girl, when you come to town you’re to visit me and I’ll put you in my very sparest spare-room bed to sleep.”",1060
3618,"“Miss Barry was a kindred spirit, after all,” Anne confided to Marilla.",1061
3619,"“You wouldn’t think so to look at her, but she is.",1061
3620,"You don’t find it right out at first, as in Matthew’s case, but after a while you come to see it.",1061
3621,Kindred spirits are not so scarce as I used to think.,1061
3622,It’s splendid to find out there are so many of them in the world.”,1061
3623, CHAPTER XX.,1063
3624,A Good Imagination Gone Wrong,1063
3625," SPRING had come once more to Green Gables--the beautiful capricious, reluctant Canadian spring, lingering along through April and May in a succession of sweet, fresh, chilly days, with pink sunsets and miracles of resurrection and growth.",1064
3626,The maples in Lover’s Lane were red budded and little curly ferns pushed up around the Dryad’s Bubble.,1064
3627,"Away up in the barrens, behind Mr. Silas Sloane’s place, the Mayflowers blossomed out, pink and white stars of sweetness under their brown leaves.",1064
3628,"All the school girls and boys had one golden afternoon gathering them, coming home in the clear, echoing twilight with arms and baskets full of flowery spoil.",1064
3629,"“I’m so sorry for people who live in lands where there are no Mayflowers,” said Anne.",1065
3630,"“Diana says perhaps they have something better, but there couldn’t be anything better than Mayflowers, could there, Marilla?",1065
3631,And Diana says if they don’t know what they are like they don’t miss them.,1065
3632,But I think that is the saddest thing of all.,1065
3633,"I think it would be _tragic_, Marilla, not to know what Mayflowers are like and _not_ to miss them.",1065
3634,"Do you know what I think Mayflowers are, Marilla?",1065
3635,I think they must be the souls of the flowers that died last summer and this is their heaven.,1065
3636,"But we had a splendid time today, Marilla.",1065
3637,We had our lunch down in a big mossy hollow by an old well--such a _romantic_ spot.,1065
3638,"Charlie Sloane dared Arty Gillis to jump over it, and Arty did because he wouldn’t take a dare.",1065
3639,Nobody would in school.,1065
3640,It is very _fashionable_ to dare.,1065
3641,"Mr. Phillips gave all the Mayflowers he found to Prissy Andrews and I heard him to say ‘sweets to the sweet.’ He got that out of a book, I know; but it shows he has some imagination.",1065
3642,"I was offered some Mayflowers too, but I rejected them with scorn.",1065
3643,I can’t tell you the person’s name because I have vowed never to let it cross my lips.,1065
3644,"We made wreaths of the Mayflowers and put them on our hats; and when the time came to go home we marched in procession down the road, two by two, with our bouquets and wreaths, singing ‘My Home on the Hill.’ Oh, it was so thrilling, Marilla.",1065
3645,All Mr. Silas Sloane’s folks rushed out to see us and everybody we met on the road stopped and stared after us.,1065
3646,We made a real sensation.”,1065
3647,“Not much wonder!,1066
3648,Such silly doings!” was Marilla’s response.,1066
3649,"After the Mayflowers came the violets, and Violet Vale was empurpled with them.",1067
3650,"Anne walked through it on her way to school with reverent steps and worshiping eyes, as if she trod on holy ground.",1067
3651,"“Somehow,” she told Diana, “when I’m going through here I don’t really care whether Gil--whether anybody gets ahead of me in class or not.",1068
3652,But when I’m up in school it’s all different and I care as much as ever.,1068
3653,There’s such a lot of different Annes in me.,1068
3654,I sometimes think that is why I’m such a troublesome person.,1068
3655,"If I was just the one Anne it would be ever so much more comfortable, but then it wouldn’t be half so interesting.”",1068
3656,"One June evening, when the orchards were pink blossomed again, when the frogs were singing silverly sweet in the marshes about the head of the Lake of Shining Waters, and the air was full of the savor of clover fields and balsamic fir woods, Anne was sitting by her gable window.",1069
3657,"She had been studying her lessons, but it had grown too dark to see the book, so she had fallen into wide-eyed reverie, looking out past the boughs of the Snow Queen, once more bestarred with its tufts of blossom.",1069
3658,In all essential respects the little gable chamber was unchanged.,1070
3659,"The walls were as white, the pincushion as hard, the chairs as stiffly and yellowly upright as ever.",1070
3660,Yet the whole character of the room was altered.,1070
3661,"It was full of a new vital, pulsing personality that seemed to pervade it and to be quite independent of schoolgirl books and dresses and ribbons, and even of the cracked blue jug full of apple blossoms on the table.",1070
3662,"It was as if all the dreams, sleeping and waking, of its vivid occupant had taken a visible although unmaterial form and had tapestried the bare room with splendid filmy tissues of rainbow and moonshine.",1070
3663,Presently Marilla came briskly in with some of Anne’s freshly ironed school aprons.,1070
3664,She hung them over a chair and sat down with a short sigh.,1070
3665,"She had had one of her headaches that afternoon, and although the pain had gone she felt weak and “tuckered out,” as she expressed it.",1070
3666,Anne looked at her with eyes limpid with sympathy.,1070
3667,"“I do truly wish I could have had the headache in your place, Marilla.",1071
3668,I would have endured it joyfully for your sake.”,1071
3669,"“I guess you did your part in attending to the work and letting me rest,” said Marilla.",1072
3670,“You seem to have got on fairly well and made fewer mistakes than usual.,1072
3671,Of course it wasn’t exactly necessary to starch Matthew’s handkerchiefs!,1072
3672,And most people when they put a pie in the oven to warm up for dinner take it out and eat it when it gets hot instead of leaving it to be burned to a crisp.,1072
3673,But that doesn’t seem to be your way evidently.”,1072
3674,Headaches always left Marilla somewhat sarcastic.,1073
3675,"“Oh, I’m so sorry,” said Anne penitently.",1074
3676,"“I never thought about that pie from the moment I put it in the oven till now, although I felt _instinctively_ that there was something missing on the dinner table.",1074
3677,"I was firmly resolved, when you left me in charge this morning, not to imagine anything, but keep my thoughts on facts.",1074
3678,"I did pretty well until I put the pie in, and then an irresistible temptation came to me to imagine I was an enchanted princess shut up in a lonely tower with a handsome knight riding to my rescue on a coal-black steed.",1074
3679,So that is how I came to forget the pie.,1074
3680,I didn’t know I starched the handkerchiefs.,1074
3681,All the time I was ironing I was trying to think of a name for a new island Diana and I have discovered up the brook.,1074
3682,"It’s the most ravishing spot, Marilla.",1074
3683,There are two maple trees on it and the brook flows right around it.,1074
3684,At last it struck me that it would be splendid to call it Victoria Island because we found it on the Queen’s birthday.,1074
3685,Both Diana and I are very loyal.,1074
3686,But I’m sorry about that pie and the handkerchiefs.,1074
3687,I wanted to be extra good today because it’s an anniversary.,1074
3688,"Do you remember what happened this day last year, Marilla?”",1074
3689,"“No, I can’t think of anything special.”",1075
3690,"“Oh, Marilla, it was the day I came to Green Gables.",1076
3691,I shall never forget it.,1076
3692,It was the turning point in my life.,1076
3693,Of course it wouldn’t seem so important to you.,1076
3694,I’ve been here for a year and I’ve been so happy.,1076
3695,"Of course, I’ve had my troubles, but one can live down troubles.",1076
3696,"Are you sorry you kept me, Marilla?”",1076
