,sentences,paragraph
3080,"goes the second one, and he tumblesbackwards onto the ground, heavy and solid, with his arms spread out.",989
3081,"That young girl screamed out and comes rushing, and down she throwsherself on her father, crying, and saying, “Oh, he’s killed him, he’skilled him!” The crowd closed up around them, and shouldered and jammedone another, with their necks stretched, trying to see, and people onthe inside trying to shove them back and shouting, “Back, back!",989
3082,"givehim air, give him air!”",989
3083,"Colonel Sherburn he tossed his pistol onto the ground, and turnedaround on his heels and walked off.",990
3084,"They took Boggs to a little drug store, the crowd pressing around justthe same, and the whole town following, and I rushed and got a goodplace at the window, where I was close to him and could see in.",991
3085,"Theylaid him on the floor and put one large Bible under his head, andopened another one and spread it on his breast; but they tore open hisshirt first, and I seen where one of the bullets went in.",991
3086,"He made abouta dozen long gasps, his breast lifting the Bible up when he drawed inhis breath, and letting it down again when he breathed it out—and afterthat he laid still; he was dead.",991
3087,"Then they pulled his daughter awayfrom him, screaming and crying, and took her off.",991
3088,"She was aboutsixteen, and very sweet and gentle-looking, but awful pale and scared.",991
3089,"Well, pretty soon the whole town was there, squirming and scrouging andpushing and shoving to get at the window and have a look, but peoplethat had the places wouldn’t give them up, and folks behind them wassaying all the time, “Say, now, you’ve looked enough, you fellows;’tain’t right and ’tain’t fair for you to stay thar all the time, andnever give nobody a chance; other folks has their rights as well asyou.”",992
3090,"There was considerable jawing back, so I slid out, thinking maybe therewas going to be trouble.",993
3091,"The streets was full, and everybody wasexcited.",993
3092,"Everybody that seen the shooting was telling how it happened,and there was a big crowd packed around each one of these fellows,stretching their necks and listening.",993
3093,"One long, lanky man, with longhair and a big white fur stovepipe hat on the back of his head, and acrooked-handled cane, marked out the places on the ground where Boggsstood and where Sherburn stood, and the people following him aroundfrom one place to t’other and watching everything he done, and bobbingtheir heads to show they understood, and stooping a little and restingtheir hands on their thighs to watch him mark the places on the groundwith his cane; and then he stood up straight and stiff where Sherburnhad stood, frowning and having his hat-brim down over his eyes, andsung out, “Boggs!” and then fetched his cane down slow to a level, andsays “Bang!” staggered backwards, says “Bang!” again, and fell downflat on his back.",993
3094,The people that had seen the thing said he done itperfect; said it was just exactly the way it all happened.,993
3095,Then as muchas a dozen people got out their bottles and treated him.,993
3096,"Well, by-and-by somebody said Sherburn ought to be lynched.",994
3097,"In about aminute everybody was saying it; so away they went, mad and yelling, andsnatching down every clothes-line they come to, to do the hanging with.",994
3098,CHAPTER XXII.,996
3099,"They swarmed up towards Sherburn’s house, a-whooping and raging likeInjuns, and everything had to clear the way or get run over and trompedto mush, and it was awful to see.",997
3100,"Children was heeling it ahead of themob, screaming and trying to get out of the way; and every window alongthe road was full of women’s heads, and there was nigger boys in everytree, and bucks and wenches looking over every fence; and as soon asthe mob would get nearly to them they would break and skaddle back outof reach.",997
3101,"Lots of the women and girls was crying and taking on, scaredmost to death.",997
3102,"They swarmed up in front of Sherburn’s palings as thick as they couldjam together, and you couldn’t hear yourself think for the noise.",998
3103,Itwas a little twenty-foot yard.,998
3104,Some sung out “Tear down the fence!,998
3105,"teardown the fence!” Then there was a racket of ripping and tearing andsmashing, and down she goes, and the front wall of the crowd begins toroll in like a wave.",998
3106,"Just then Sherburn steps out on to the roof of his little front porch,with a double-barrel gun in his hand, and takes his stand, perfectlyca’m and deliberate, not saying a word.",999
3107,"The racket stopped, and thewave sucked back.",999
3108,"Sherburn never said a word—just stood there, looking down.",1000
3109,Thestillness was awful creepy and uncomfortable.,1000
3110,"Sherburn run his eye slowalong the crowd; and wherever it struck the people tried a little toout-gaze him, but they couldn’t; they dropped their eyes and lookedsneaky.",1000
3111,"Then pretty soon Sherburn sort of laughed; not the pleasantkind, but the kind that makes you feel like when you are eating breadthat’s got sand in it.",1000
3112,"Then he says, slow and scornful:",1001
3113,“The idea of _you_ lynching anybody!,1002
3114,It’s amusing.,1002
3115,"The idea of youthinking you had pluck enough to lynch a _man!_ Because you’re braveenough to tar and feather poor friendless cast-out women that comealong here, did that make you think you had grit enough to lay yourhands on a _man?_ Why, a _man’s_ safe in the hands of ten thousand ofyour kind—as long as it’s daytime and you’re not behind him.",1002
3116,“Do I know you?,1003
3117,I know you clear through.,1003
3118,"I was born and raised in theSouth, and I’ve lived in the North; so I know the average all around.",1003
3119,The average man’s a coward.,1003
3120,"In the North he lets anybody walk over himthat wants to, and goes home and prays for a humble spirit to bear it.",1003
3121,"In the South one man all by himself, has stopped a stage full of men inthe daytime, and robbed the lot.",1003
3122,"Your newspapers call you a bravepeople so much that you think you _are_ braver than any otherpeople—whereas you’re just _as_ brave, and no braver.",1003
3123,Why don’t yourjuries hang murderers?,1003
3124,"Because they’re afraid the man’s friends willshoot them in the back, in the dark—and it’s just what they _would_ do.",1003
3125,"“So they always acquit; and then a _man_ goes in the night, with ahundred masked cowards at his back and lynches the rascal.",1004
3126,"Your mistakeis, that you didn’t bring a man with you; that’s one mistake, and theother is that you didn’t come in the dark and fetch your masks.",1004
3127,"Youbrought _part_ of a man—Buck Harkness, there—and if you hadn’t had himto start you, you’d a taken it out in blowing.",1004
3128,“You didn’t want to come.,1005
3129,The average man don’t like trouble anddanger.,1005
3130,_You_ don’t like trouble and danger.,1005
3131,"But if only _half_ aman—like Buck Harkness, there—shouts ‘Lynch him!",1005
3132,"lynch him!’ you’reafraid to back down—afraid you’ll be found out to be what youare—_cowards_—and so you raise a yell, and hang yourselves on to thathalf-a-man’s coat-tail, and come raging up here, swearing what bigthings you’re going to do.",1005
3133,"The pitifulest thing out is a mob; that’swhat an army is—a mob; they don’t fight with courage that’s born inthem, but with courage that’s borrowed from their mass, and from theirofficers.",1005
3134,But a mob without any _man_ at the head of it is _beneath_pitifulness.,1005
3135,Now the thing for _you_ to do is to droop your tails andgo home and crawl in a hole.,1005
3136,"If any real lynching’s going to be done, itwill be done in the dark, Southern fashion; and when they come they’llbring their masks, and fetch a _man_ along.",1005
3137,Now _leave_—and take yourhalf-a-man with you”—tossing his gun up across his left arm and cockingit when he says this.,1005
3138,"The crowd washed back sudden, and then broke all apart, and wenttearing off every which way, and Buck Harkness he heeled it after them,looking tolerable cheap.",1006
3139,"I could a staid if I wanted to, but I didn’twant to.",1006
3140,"I went to the circus and loafed around the back side till the watchmanwent by, and then dived in under the tent.",1007
3141,"I had my twenty-dollar goldpiece and some other money, but I reckoned I better save it, becausethere ain’t no telling how soon you are going to need it, away fromhome and amongst strangers that way.",1007
3142,You can’t be too careful.,1007
3143,"I ain’topposed to spending money on circuses when there ain’t no other way,but there ain’t no use in _wasting_ it on them.",1007
3144,It was a real bully circus.,1008
3145,"It was the splendidest sight that ever waswhen they all come riding in, two and two, a gentleman and lady, sideby side, the men just in their drawers and undershirts, and no shoesnor stirrups, and resting their hands on their thighs easy andcomfortable—there must a been twenty of them—and every lady with alovely complexion, and perfectly beautiful, and looking just like agang of real sure-enough queens, and dressed in clothes that costmillions of dollars, and just littered with diamonds.",1008
3146,It was a powerfulfine sight; I never see anything so lovely.,1008
3147,"And then one by one theygot up and stood, and went a-weaving around the ring so gentle and wavyand graceful, the men looking ever so tall and airy and straight, withtheir heads bobbing and skimming along, away up there under thetent-roof, and every lady’s rose-leafy dress flapping soft and silkyaround her hips, and she looking like the most loveliest parasol.",1008
3148,"And then faster and faster they went, all of them dancing, first onefoot out in the air and then the other, the horses leaning more andmore, and the ring-master going round and round the center-pole,cracking his whip and shouting “Hi!—hi!” and the clown cracking jokesbehind him; and by-and-by all hands dropped the reins, and every ladyput her knuckles on her hips and every gentleman folded his arms, andthen how the horses did lean over and hump themselves!",1009
3149,"And so one afterthe other they all skipped off into the ring, and made the sweetest bowI ever see, and then scampered out, and everybody clapped their handsand went just about wild.",1009
3150,"Well, all through the circus they done the most astonishing things; andall the time that clown carried on so it most killed the people.",1010
3151,"Thering-master couldn’t ever say a word to him but he was back at him quickas a wink with the funniest things a body ever said; and how he ever_could_ think of so many of them, and so sudden and so pat, was what Icouldn’t noway understand.",1010
3152,"Why, I couldn’t a thought of them in a year.",1010
3153,And by-and-by a drunk man tried to get into the ring—said he wanted toride; said he could ride as well as anybody that ever was.,1010
3154,"They arguedand tried to keep him out, but he wouldn’t listen, and the whole showcome to a standstill.",1010
3155,"Then the people begun to holler at him and makefun of him, and that made him mad, and he begun to rip and tear; sothat stirred up the people, and a lot of men begun to pile down off ofthe benches and swarm towards the ring, saying, “Knock him down!",1010
3156,throwhim out!” and one or two women begun to scream.,1010
3157,"So, then, thering-master he made a little speech, and said he hoped there wouldn’t beno disturbance, and if the man would promise he wouldn’t make no moretrouble he would let him ride if he thought he could stay on the horse.",1010
3158,"So everybody laughed and said all right, and the man got on.",1010
3159,"The minutehe was on, the horse begun to rip and tear and jump and cavort around,with two circus men hanging on to his bridle trying to hold him, andthe drunk man hanging on to his neck, and his heels flying in the airevery jump, and the whole crowd of people standing up shouting andlaughing till tears rolled down.",1010
3160,"And at last, sure enough, all thecircus men could do, the horse broke loose, and away he went like thevery nation, round and round the ring, with that sot laying down on himand hanging to his neck, with first one leg hanging most to the groundon one side, and then t’other one on t’other side, and the people justcrazy.",1010
3161,"It warn’t funny to me, though; I was all of a tremble to see hisdanger.",1010
3162,"But pretty soon he struggled up astraddle and grabbed thebridle, a-reeling this way and that; and the next minute he sprung upand dropped the bridle and stood!",1010
3163,and the horse a-going like a houseafire too.,1010
3164,"He just stood up there, a-sailing around as easy andcomfortable as if he warn’t ever drunk in his life—and then he begun topull off his clothes and sling them.",1010
3165,"He shed them so thick they kind ofclogged up the air, and altogether he shed seventeen suits.",1010
3166,"And, then,there he was, slim and handsome, and dressed the gaudiest and prettiestyou ever saw, and he lit into that horse with his whip and made himfairly hum—and finally skipped off, and made his bow and danced off tothe dressing-room, and everybody just a-howling with pleasure andastonishment.",1010
3167,"Then the ring-master he see how he had been fooled, and he _was_ thesickest ring-master you ever see, I reckon.",1011
3168,"Why, it was one of his ownmen!",1011
3169,"He had got up that joke all out of his own head, and never let onto nobody.",1011
3170,"Well, I felt sheepish enough to be took in so, but Iwouldn’t a been in that ring-master’s place, not for a thousand dollars.",1011
3171,"I don’t know; there may be bullier circuses than what that one was, butI never struck them yet.",1011
3172,"Anyways, it was plenty good enough for _me;_and wherever I run across it, it can have all of _my_ custom everytime.",1011
3173,"Well, that night we had _our_ show; but there warn’t only about twelvepeople there—just enough to pay expenses.",1012
3174,"And they laughed all thetime, and that made the duke mad; and everybody left, anyway, beforethe show was over, but one boy which was asleep.",1012
3175,"So the duke said theseArkansaw lunkheads couldn’t come up to Shakespeare; what they wantedwas low comedy—and maybe something ruther worse than low comedy, hereckoned.",1012
3176,He said he could size their style.,1012
3177,"So next morning he gotsome big sheets of wrapping paper and some black paint, and drawed offsome handbills, and stuck them up all over the village.",1012
3178,The bills said:,1012
3179,AT THE COURT HOUSE!,1013
3180,FOR 3 NIGHTS ONLY!,1013
3181,_The World-Renowned Tragedians_DAVID GARRICK THE YOUNGER!,1013
3182,ANDEDMUND KEAN THE ELDER!,1013
3183,"_Of the London and ContinentalTheatres_,In their Thrilling Tragedy ofTHE KING’S CAMELOPARDORTHE ROYAL NONESUCH!!!",1013
3184,_Admission 50 cents_.,1013
3185,Then at the bottom was the biggest line of all—which said:,1014
3186,LADIES AND CHILDREN NOT ADMITTED.,1015
3187,"“There,” says he, “if that line don’t fetch them, I dont knowArkansaw!”",1016
3188,CHAPTER XXIII.,1018
3189,"Well, all day him and the king was hard at it, rigging up a stage and acurtain and a row of candles for footlights; and that night the housewas jam full of men in no time.",1019
3190,"When the place couldn’t hold no more,the duke he quit tending door and went around the back way and come onto the stage and stood up before the curtain and made a little speech,and praised up this tragedy, and said it was the most thrillingest onethat ever was; and so he went on a-bragging about the tragedy, andabout Edmund Kean the Elder, which was to play the main principal partin it; and at last when he’d got everybody’s expectations up highenough, he rolled up the curtain, and the next minute the king comea-prancing out on all fours, naked; and he was painted all over,ring-streaked-and-striped, all sorts of colors, as splendid as arainbow.",1019
3191,"And—but never mind the rest of his outfit; it was just wild,but it was awful funny.",1019
3192,"The people most killed themselves laughing; andwhen the king got done capering and capered off behind the scenes, theyroared and clapped and stormed and haw-hawed till he come back and doneit over again, and after that they made him do it another time.",1019
3193,"Well,it would make a cow laugh to see the shines that old idiot cut.",1019
3194,"Then the duke he lets the curtain down, and bows to the people, andsays the great tragedy will be performed only two nights more, onaccounts of pressing London engagements, where the seats is all soldalready for it in Drury Lane; and then he makes them another bow, andsays if he has succeeded in pleasing them and instructing them, he willbe deeply obleeged if they will mention it to their friends and getthem to come and see it.",1020
3195,Twenty people sings out:,1021
3196,"“What, is it over?",1022
3197,Is that _all?_”,1022
3198,The duke says yes.,1023
3199,Then there was a fine time.,1023
3200,"Everybody sings out,“Sold!” and rose up mad, and was a-going for that stage and themtragedians.",1023
3201,"But a big, fine looking man jumps up on a bench and shouts:",1023
3202,“Hold on!,1024
3203,"Just a word, gentlemen.” They stopped to listen.",1024
3204,“We aresold—mighty badly sold.,1024
3205,"But we don’t want to be the laughing stock ofthis whole town, I reckon, and never hear the last of this thing aslong as we live.",1024
3206,_No_.,1024
3207,"What we want is to go out of here quiet, andtalk this show up, and sell the _rest_ of the town!",1024
3208,Then we’ll all bein the same boat.,1024
3209,Ain’t that sensible?” (“You bet it is!—the jedge isright!” everybody sings out.),1024
3210,"“All right, then—not a word about anysell.",1024
3211,"Go along home, and advise everybody to come and see the tragedy.”",1024
3212,Next day you couldn’t hear nothing around that town but how splendidthat show was.,1025
3213,"House was jammed again that night, and we sold thiscrowd the same way.",1025
3214,"When me and the king and the duke got home to theraft we all had a supper; and by-and-by, about midnight, they made Jimand me back her out and float her down the middle of the river, andfetch her in and hide her about two mile below town.",1025
3215,"The third night the house was crammed again—and they warn’t new-comersthis time, but people that was at the show the other two nights.",1026
3216,"Istood by the duke at the door, and I see that every man that went inhad his pockets bulging, or something muffled up under his coat—and Isee it warn’t no perfumery, neither, not by a long sight.",1026
3217,"I smeltsickly eggs by the barrel, and rotten cabbages, and such things; and ifI know the signs of a dead cat being around, and I bet I do, there wassixty-four of them went in.",1026
3218,"I shoved in there for a minute, but it wastoo various for me; I couldn’t stand it.",1026
3219,"Well, when the place couldn’thold no more people the duke he give a fellow a quarter and told him totend door for him a minute, and then he started around for the stagedoor, I after him; but the minute we turned the corner and was in thedark he says:",1026
3220,"“Walk fast now till you get away from the houses, and then shin for theraft like the dickens was after you!”",1027
3221,"I done it, and he done the same.",1028
3222,"We struck the raft at the same time,and in less than two seconds we was gliding down stream, all dark andstill, and edging towards the middle of the river, nobody saying aword.",1028
3223,"I reckoned the poor king was in for a gaudy time of it with theaudience, but nothing of the sort; pretty soon he crawls out from underthe wigwam, and says:",1028
3224,"“Well, how’d the old thing pan out this time, duke?”",1029
3225,He hadn’t been up town at all.,1030
3226,We never showed a light till we was about ten mile below the village.,1031
3227,"Then we lit up and had a supper, and the king and the duke fairlylaughed their bones loose over the way they’d served them people.",1031
3228,Theduke says:,1031
3229,"“Greenhorns, flatheads!",1032
3230,"_I_ knew the first house would keep mum and letthe rest of the town get roped in; and I knew they’d lay for us thethird night, and consider it was _their_ turn now.",1032
3231,"Well, it _is_ theirturn, and I’d give something to know how much they’d take for it.",1032
3232,I_would_ just like to know how they’re putting in their opportunity.,1032
3233,They can turn it into a picnic if they want to—they brought plentyprovisions.”,1032
3234,Them rapscallions took in four hundred and sixty-five dollars in thatthree nights.,1033
3235,I never see money hauled in by the wagon-load like thatbefore.,1033
3236,"By-and-by, when they was asleep and snoring, Jim says:",1033
3237,"“Don’t it s’prise you de way dem kings carries on, Huck?”",1034
3238,"“No,” I says, “it don’t.”",1035
3239,"“Why don’t it, Huck?”",1036
3240,"“Well, it don’t, because it’s in the breed.",1037
3241,I reckon they’re allalike.”,1037
3242,"“But, Huck, dese kings o’ ourn is reglar rapscallions; dat’s jist whatdey is; dey’s reglar rapscallions.”",1038
3243,"“Well, that’s what I’m a-saying; all kings is mostly rapscallions, asfur as I can make out.”",1039
3244,“Is dat so?”,1040
3245,“You read about them once—you’ll see.,1041
3246,Look at Henry the Eight; this’n’s a Sunday-school Superintendent to _him_.,1041
3247,"And look at Charles Second,and Louis Fourteen, and Louis Fifteen, and James Second, and EdwardSecond, and Richard Third, and forty more; besides all them Saxonheptarchies that used to rip around so in old times and raise Cain.",1041
3248,"My,you ought to seen old Henry the Eight when he was in bloom.",1041
3249,He _was_ ablossom.,1041
3250,"He used to marry a new wife every day, and chop off her headnext morning.",1041
3251,And he would do it just as indifferent as if he wasordering up eggs.,1041
3252,"‘Fetch up Nell Gwynn,’ he says.",1041
3253,They fetch her up.,1041
3254,"Next morning, ‘Chop off her head!’ And they chop it off.",1041
3255,"‘Fetch up JaneShore,’ he says; and up she comes.",1041
3256,"Next morning, ‘Chop off herhead’—and they chop it off.",1041
3257,‘Ring up Fair Rosamun.’ Fair Rosamunanswers the bell.,1041
3258,"Next morning, ‘Chop off her head.’ And he made everyone of them tell him a tale every night; and he kept that up till hehad hogged a thousand and one tales that way, and then he put them allin a book, and called it Domesday Book—which was a good name and statedthe case.",1041
3259,"You don’t know kings, Jim, but I know them; and this old ripof ourn is one of the cleanest I’ve struck in history.",1041
3260,"Well, Henry hetakes a notion he wants to get up some trouble with this country.",1041
3261,Howdoes he go at it—give notice?—give the country a show?,1041
3262,No.,1041
3263,"All of asudden he heaves all the tea in Boston Harbor overboard, and whacks outa declaration of independence, and dares them to come on.",1041
3264,That was_his_ style—he never give anybody a chance.,1041
3265,"He had suspicions of hisfather, the Duke of Wellington.",1041
3266,"Well, what did he do?",1041
3267,Ask him to showup?,1041
3268,"No—drownded him in a butt of mamsey, like a cat.",1041
3269,S’pose people leftmoney laying around where he was—what did he do?,1041
3270,He collared it.,1041
3271,"S’posehe contracted to do a thing, and you paid him, and didn’t set downthere and see that he done it—what did he do?",1041
3272,He always done the otherthing.,1041
3273,S’pose he opened his mouth—what then?,1041
3274,If he didn’t shut it uppowerful quick he’d lose a lie every time.,1041
3275,That’s the kind of a bugHenry was; and if we’d a had him along ’stead of our kings he’d afooled that town a heap worse than ourn done.,1041
3276,"I don’t say that ourn islambs, because they ain’t, when you come right down to the cold facts;but they ain’t nothing to _that_ old ram, anyway.",1041
3277,"All I say is, kingsis kings, and you got to make allowances.",1041
3278,"Take them all around, they’rea mighty ornery lot.",1041
3279,It’s the way they’re raised.”,1041
3280,"“But dis one do _smell_ so like de nation, Huck.”",1042
3281,"“Well, they all do, Jim.",1043
3282,_We_ can’t help the way a king smells; historydon’t tell no way.”,1043
3283,"“Now de duke, he’s a tolerble likely man in some ways.”",1044
3284,"“Yes, a duke’s different.",1045
3285,But not very different.,1045
3286,This one’s a middlinghard lot for a duke.,1045
3287,"When he’s drunk, there ain’t no near-sighted mancould tell him from a king.”",1045
3288,"“Well, anyways, I doan’ hanker for no mo’ un um, Huck.",1046
3289,Dese is all Ikin stan’.”,1046
3290,"“It’s the way I feel, too, Jim.",1047
3291,"But we’ve got them on our hands, and wegot to remember what they are, and make allowances.",1047
3292,Sometimes I wish wecould hear of a country that’s out of kings.”,1047
3293,What was the use to tell Jim these warn’t real kings and dukes?,1048
3294,"Itwouldn’t a done no good; and, besides, it was just as I said: youcouldn’t tell them from the real kind.",1048
3295,"I went to sleep, and Jim didn’t call me when it was my turn.",1049
3296,He oftendone that.,1049
3297,"When I waked up just at daybreak, he was sitting there withhis head down betwixt his knees, moaning and mourning to himself.",1049
3298,Ididn’t take notice nor let on.,1049
3299,I knowed what it was about.,1049
