,sentences,paragraph
1624,"We didn’t touch an oar, and we didn’t speak nor whisper, nor hardlyeven breathe.",448
1625,"We went gliding swift along, dead silent, past the tip ofthe paddle-box, and past the stern; then in a second or two more we wasa hundred yards below the wreck, and the darkness soaked her up, everylast sign of her, and we was safe, and knowed it.",448
1626,"When we was three or four hundred yards down-stream we see the lanternshow like a little spark at the texas door for a second, and we knowedby that that the rascals had missed their boat, and was beginning tounderstand that they was in just as much trouble now as Jim Turner was.",449
1627,"Then Jim manned the oars, and we took out after our raft.",450
1628,Now was thefirst time that I begun to worry about the men—I reckon I hadn’t hadtime to before.,450
1629,"I begun to think how dreadful it was, even formurderers, to be in such a fix.",450
1630,"I says to myself, there ain’t notelling but I might come to be a murderer myself yet, and then howwould _I_ like it?",450
1631,So says I to Jim:,450
1632,"“The first light we see we’ll land a hundred yards below it or aboveit, in a place where it’s a good hiding-place for you and the skiff,and then I’ll go and fix up some kind of a yarn, and get somebody to gofor that gang and get them out of their scrape, so they can be hungwhen their time comes.”",451
1633,"But that idea was a failure; for pretty soon it begun to storm again,and this time worse than ever.",452
1634,"The rain poured down, and never a lightshowed; everybody in bed, I reckon.",452
1635,"We boomed along down the river,watching for lights and watching for our raft.",452
1636,"After a long time therain let up, but the clouds stayed, and the lightning kept whimpering,and by-and-by a flash showed us a black thing ahead, floating, and wemade for it.",452
1637,"It was the raft, and mighty glad was we to get aboard of it again.",453
1638,"Weseen a light now away down to the right, on shore.",453
1639,So I said I would gofor it.,453
1640,The skiff was half full of plunder which that gang had stolethere on the wreck.,453
1641,"We hustled it on to the raft in a pile, and I toldJim to float along down, and show a light when he judged he had goneabout two mile, and keep it burning till I come; then I manned my oarsand shoved for the light.",453
1642,"As I got down towards it, three or four moreshowed—up on a hillside.",453
1643,It was a village.,453
1644,"I closed in above the shorelight, and laid on my oars and floated.",453
1645,"As I went by, I see it was alantern hanging on the jackstaff of a double-hull ferry-boat.",453
1646,"I skimmedaround for the watchman, a-wondering whereabouts he slept; andby-and-by I found him roosting on the bitts, forward, with his headdown between his knees.",453
1647,"I gave his shoulder two or three little shoves,and begun to cry.",453
1648,"He stirred up, in a kind of a startlish way; but when he see it was onlyme, he took a good gap and stretch, and then he says:",454
1649,"“Hello, what’s up?",455
1650,"Don’t cry, bub.",455
1651,What’s the trouble?”,455
1652,I says:,456
1653,"“Pap, and mam, and sis, and—”",457
1654,Then I broke down.,458
1655,He says:,458
1656,"“Oh, dang it now, _don’t_ take on so; we all has to have our troubles,and this’n ’ll come out all right.",459
1657,What’s the matter with ’em?”,459
1658,“They’re—they’re—are you the watchman of the boat?”,460
1659,"“Yes,” he says, kind of pretty-well-satisfied like.",461
1660,“I’m the captainand the owner and the mate and the pilot and watchman and headdeck-hand; and sometimes I’m the freight and passengers.,461
1661,"I ain’t asrich as old Jim Hornback, and I can’t be so blame’ generous and good toTom, Dick and Harry as what he is, and slam around money the way hedoes; but I’ve told him a many a time ’t I wouldn’t trade places withhim; for, says I, a sailor’s life’s the life for me, and I’m derned if_I’d_ live two mile out o’ town, where there ain’t nothing ever goin’on, not for all his spondulicks and as much more on top of it.",461
1662,Says I—”,461
1663,I broke in and says:,462
1664,"“They’re in an awful peck of trouble, and—”",463
1665,“_Who_ is?”,464
1666,"“Why, pap and mam and sis and Miss Hooker; and if you’d take yourferry-boat and go up there—”",465
1667,“Up where?,466
1668,Where are they?”,466
1669,“On the wreck.”,467
1670,“What wreck?”,468
1671,"“Why, there ain’t but one.”",469
1672,"“What, you don’t mean the _Walter Scott?_”",470
1673,“Yes.”,471
1674,“Good land!,472
1675,"what are they doin’ _there_, for gracious sakes?”",472
1676,"“Well, they didn’t go there a-purpose.”",473
1677,“I bet they didn’t!,474
1678,"Why, great goodness, there ain’t no chance for ’emif they don’t git off mighty quick!",474
1679,"Why, how in the nation did theyever git into such a scrape?”",474
1680,“Easy enough.,475
1681,Miss Hooker was a-visiting up there to the town—”,475
1682,"“Yes, Booth’s Landing—go on.”",476
1683,"“She was a-visiting there at Booth’s Landing, and just in the edge ofthe evening she started over with her nigger woman in the horse-ferryto stay all night at her friend’s house, Miss What-you-may-call-her Idisremember her name—and they lost their steering-oar, and swung aroundand went a-floating down, stern first, about two mile, andsaddle-baggsed on the wreck, and the ferryman and the nigger woman andthe horses was all lost, but Miss Hooker she made a grab and got aboardthe wreck.",477
1684,"Well, about an hour after dark we come along down in ourtrading-scow, and it was so dark we didn’t notice the wreck till we wasright on it; and so _we_ saddle-baggsed; but all of us was saved butBill Whipple—and oh, he _was_ the best cretur!—I most wish’t it hadbeen me, I do.”",477
1685,“My George!,478
1686,It’s the beatenest thing I ever struck.,478
1687,And _then_ what didyou all do?”,478
1688,"“Well, we hollered and took on, but it’s so wide there we couldn’t makenobody hear.",479
1689,So pap said somebody got to get ashore and get helpsomehow.,479
1690,"I was the only one that could swim, so I made a dash for it,and Miss Hooker she said if I didn’t strike help sooner, come here andhunt up her uncle, and he’d fix the thing.",479
1691,"I made the land about a milebelow, and been fooling along ever since, trying to get people to dosomething, but they said, ‘What, in such a night and such a current?",479
1692,There ain’t no sense in it; go for the steam ferry.’ Now if you’ll goand—”,479
1693,"“By Jackson, I’d _like_ to, and, blame it, I don’t know but I will; butwho in the dingnation’s a-going’ to _pay_ for it?",480
1694,Do you reckon yourpap—”,480
1695,“Why _that’s_ all right.,481
1696,"Miss Hooker she tole me, _particular_, thather uncle Hornback—”",481
1697,“Great guns!,482
1698,is _he_ her uncle?,482
1699,"Looky here, you break for that lightover yonder-way, and turn out west when you git there, and about aquarter of a mile out you’ll come to the tavern; tell ’em to dart youout to Jim Hornback’s, and he’ll foot the bill.",482
1700,"And don’t you foolaround any, because he’ll want to know the news.",482
1701,Tell him I’ll have hisniece all safe before he can get to town.,482
1702,"Hump yourself, now; I’ma-going up around the corner here to roust out my engineer.”",482
1703,"I struck for the light, but as soon as he turned the corner I went backand got into my skiff and bailed her out, and then pulled up shore inthe easy water about six hundred yards, and tucked myself in among somewoodboats; for I couldn’t rest easy till I could see the ferry-boatstart.",483
1704,"But take it all around, I was feeling ruther comfortable onaccounts of taking all this trouble for that gang, for not many would adone it.",483
1705,I wished the widow knowed about it.,483
1706,"I judged she would beproud of me for helping these rapscallions, because rapscallions anddead beats is the kind the widow and good people takes the mostinterest in.",483
1707,"Well, before long, here comes the wreck, dim and dusky, sliding alongdown!",484
1708,"A kind of cold shiver went through me, and then I struck out forher.",484
1709,"She was very deep, and I see in a minute there warn’t much chancefor anybody being alive in her.",484
1710,"I pulled all around her and hollered alittle, but there wasn’t any answer; all dead still.",484
1711,"I felt a littlebit heavy-hearted about the gang, but not much, for I reckoned if theycould stand it, I could.",484
1712,"Then here comes the ferry-boat; so I shoved for the middle of the riveron a long down-stream slant; and when I judged I was out of eye-reach, Ilaid on my oars, and looked back and see her go and smell around thewreck for Miss Hooker’s remainders, because the captain would know heruncle Hornback would want them; and then pretty soon the ferry-boat giveit up and went for the shore, and I laid into my work and wenta-booming down the river.",485
1713,"It did seem a powerful long time before Jim’s light showed up; and whenit did show, it looked like it was a thousand mile off.",486
1714,"By the time Igot there the sky was beginning to get a little gray in the east; so westruck for an island, and hid the raft, and sunk the skiff, and turnedin and slept like dead people.",486
1715,CHAPTER XIV.,488
1716,"By-and-by, when we got up, we turned over the truck the gang had stoleoff of the wreck, and found boots, and blankets, and clothes, and allsorts of other things, and a lot of books, and a spyglass, and threeboxes of seegars.",489
1717,We hadn’t ever been this rich before in neither ofour lives.,489
1718,The seegars was prime.,489
1719,"We laid off all the afternoon in thewoods talking, and me reading the books, and having a general goodtime.",489
1720,"I told Jim all about what happened inside the wreck and at theferry-boat, and I said these kinds of things was adventures; but he saidhe didn’t want no more adventures.",489
1721,"He said that when I went in thetexas and he crawled back to get on the raft and found her gone, henearly died; because he judged it was all up with _him_, anyway it couldbe fixed; for if he didn’t get saved he would get drownded; and if hedid get saved, whoever saved him would send him back home so as to getthe reward, and then Miss Watson would sell him South, sure.",489
1722,"Well, hewas right; he was most always right; he had an uncommon level head, fora nigger.",489
1723,"I read considerable to Jim about kings and dukes and earls and such,and how gaudy they dressed, and how much style they put on, and calledeach other your majesty, and your grace, and your lordship, and so on,’stead of mister; and Jim’s eyes bugged out, and he was interested.",490
1724,Hesays:,490
1725,“I didn’ know dey was so many un um.,491
1726,"I hain’t hearn ’bout none un um,skasely, but ole King Sollermun, onless you counts dem kings dat’s in apack er k’yards.",491
1727,How much do a king git?”,491
1728,"“Get?” I says; “why, they get a thousand dollars a month if they wantit; they can have just as much as they want; everything belongs tothem.”",492
1729,“_Ain’_ dat gay?,493
1730,"En what dey got to do, Huck?”",493
1731,“_They_ don’t do nothing!,494
1732,"Why, how you talk!",494
1733,They just set around.”,494
1734,“No; is dat so?”,495
1735,“Of course it is.,496
1736,"They just set around—except, maybe, when there’s awar; then they go to the war.",496
1737,But other times they just lazy around; orgo hawking—just hawking and sp— Sh!—d’ you hear a noise?”,496
1738,"We skipped out and looked; but it warn’t nothing but the flutter of asteamboat’s wheel away down, coming around the point; so we come back.",497
1739,"“Yes,” says I, “and other times, when things is dull, they fuss withthe parlyment; and if everybody don’t go just so he whacks their headsoff.",498
1740,But mostly they hang round the harem.”,498
1741,“Roun’ de which?”,499
1742,“Harem.”,500
1743,“What’s de harem?”,501
1744,“The place where he keeps his wives.,502
1745,Don’t you know about the harem?,502
1746,Solomon had one; he had about a million wives.”,502
1747,"“Why, yes, dat’s so; I—I’d done forgot it.",503
1748,"A harem’s a bo’d’n-house, Ireck’n.",503
1749,Mos’ likely dey has rackety times in de nussery.,503
1750,En I reck’n dewives quarrels considable; en dat ’crease de racket.,503
1751,Yit dey saySollermun de wises’ man dat ever live’.,503
1752,I doan’ take no stock in dat.,503
1753,Bekase why: would a wise man want to live in de mids’ er sich ablim-blammin’ all de time?,503
1754,No—’deed he wouldn’t.,503
1755,A wise man ’ud take enbuil’ a biler-factry; en den he could shet _down_ de biler-factry whenhe want to res’.”,503
1756,"“Well, but he _was_ the wisest man, anyway; because the widow she toldme so, her own self.”",504
1757,"“I doan k’yer what de widder say, he _warn’t_ no wise man nuther.",505
1758,Hehad some er de dad-fetchedes’ ways I ever see.,505
1759,Does you know ’bout datchile dat he ’uz gwyne to chop in two?”,505
1760,"“Yes, the widow told me all about it.”",506
1761,"“_Well_, den!",507
1762,Warn’ dat de beatenes’ notion in de worl’?,507
1763,You jes’ takeen look at it a minute.,507
1764,"Dah’s de stump, dah—dat’s one er de women;heah’s you—dat’s de yuther one; I’s Sollermun; en dish yer dollarbill’s de chile.",507
1765,Bofe un you claims it.,507
1766,What does I do?,507
1767,"Does I shinaroun’ mongs’ de neighbors en fine out which un you de bill _do_ b’longto, en han’ it over to de right one, all safe en soun’, de way datanybody dat had any gumption would?",507
1768,"No; I take en whack de bill in_two_, en give half un it to you, en de yuther half to de yuther woman.",507
1769,Dat’s de way Sollermun was gwyne to do wid de chile.,507
1770,Now I want to astyou: what’s de use er dat half a bill?—can’t buy noth’n wid it.,507
1771,En whatuse is a half a chile?,507
1772,I wouldn’ give a dern for a million un um.”,507
1773,"“But hang it, Jim, you’ve clean missed the point—blame it, you’vemissed it a thousand mile.”",508
1774,“Who?,509
1775,Me?,509
1776,Go ’long.,509
1777,Doan’ talk to _me_ ’bout yo’ pints.,509
1778,I reck’n Iknows sense when I sees it; en dey ain’ no sense in sich doin’s as dat.,509
1779,"De ’spute warn’t ’bout a half a chile, de ’spute was ’bout a wholechile; en de man dat think he kin settle a ’spute ’bout a whole chilewid a half a chile doan’ know enough to come in out’n de rain.",509
1780,"Doan’talk to me ’bout Sollermun, Huck, I knows him by de back.”",509
1781,“But I tell you you don’t get the point.”,510
1782,“Blame de point!,511
1783,I reck’n I knows what I knows.,511
1784,"En mine you, de _real_pint is down furder—it’s down deeper.",511
1785,It lays in de way Sollermun wasraised.,511
1786,You take a man dat’s got on’y one or two chillen; is dat mangwyne to be waseful o’ chillen?,511
1787,"No, he ain’t; he can’t ’ford it.",511
1788,_He_know how to value ’em.,511
1789,"But you take a man dat’s got ’bout five millionchillen runnin’ roun’ de house, en it’s diffunt.",511
1790,_He_ as soon chop achile in two as a cat.,511
1791,Dey’s plenty mo’.,511
1792,"A chile er two, mo’ er less,warn’t no consekens to Sollermun, dad fatch him!”",511
1793,I never see such a nigger.,512
1794,"If he got a notion in his head once, therewarn’t no getting it out again.",512
1795,He was the most down on Solomon of anynigger I ever see.,512
1796,"So I went to talking about other kings, and letSolomon slide.",512
1797,"I told about Louis Sixteenth that got his head cut offin France long time ago; and about his little boy the dolphin, thatwould a been a king, but they took and shut him up in jail, and somesay he died there.",512
1798,“Po’ little chap.”,513
1799,"“But some says he got out and got away, and come to America.”",514
1800,“Dat’s good!,515
1801,"But he’ll be pooty lonesome—dey ain’ no kings here, isdey, Huck?”",515
1802,“No.”,516
1803,“Den he cain’t git no situation.,517
1804,What he gwyne to do?”,517
1805,"“Well, I don’t know.",518
1806,"Some of them gets on the police, and some of themlearns people how to talk French.”",518
1807,"“Why, Huck, doan’ de French people talk de same way we does?”",519
1808,"“_No_, Jim; you couldn’t understand a word they said—not a singleword.”",520
1809,"“Well, now, I be ding-busted!",521
1810,How do dat come?”,521
1811,“_I_ don’t know; but it’s so.,522
1812,I got some of their jabber out of a book.,522
1813,S’pose a man was to come to you and say _Polly-voo-franzy_—what wouldyou think?”,522
1814,"“I wouldn’ think nuff’n; I’d take en bust him over de head—dat is, ifhe warn’t white.",523
1815,I wouldn’t ’low no nigger to call me dat.”,523
1816,"“Shucks, it ain’t calling you anything.",524
1817,"It’s only saying, do you knowhow to talk French?”",524
1818,"“Well, den, why couldn’t he _say_ it?”",525
1819,"“Why, he _is_ a-saying it.",526
1820,That’s a Frenchman’s _way_ of saying it.”,526
1821,"“Well, it’s a blame ridicklous way, en I doan’ want to hear no mo’’bout it.",527
1822,Dey ain’ no sense in it.”,527
1823,"“Looky here, Jim; does a cat talk like we do?”",528
1824,"“No, a cat don’t.”",529
1825,"“Well, does a cow?”",530
1826,"“No, a cow don’t, nuther.”",531
1827,"“Does a cat talk like a cow, or a cow talk like a cat?”",532
1828,"“No, dey don’t.”",533
1829,"“It’s natural and right for ’em to talk different from each other,ain’t it?”",534
1830,“’Course.”,535
1831,“And ain’t it natural and right for a cat and a cow to talk differentfrom _us?_”,536
1832,"“Why, mos’ sholy it is.”",537
1833,"“Well, then, why ain’t it natural and right for a _Frenchman_ to talkdifferent from us?",538
1834,You answer me that.”,538
1835,"“Is a cat a man, Huck?”",539
1836,“No.”,540
1837,"“Well, den, dey ain’t no sense in a cat talkin’ like a man.",541
1838,Is a cow aman?—er is a cow a cat?”,541
1839,"“No, she ain’t either of them.”",542
1840,"“Well, den, she ain’t got no business to talk like either one er theyuther of ’em.",543
1841,Is a Frenchman a man?”,543
1842,“Yes.”,544
1843,"“_Well_, den!",545
1844,"Dad blame it, why doan’ he _talk_ like a man?",545
1845,You answerme _dat!_”,545
1846,I see it warn’t no use wasting words—you can’t learn a nigger to argue.,546
1847,So I quit.,546
1848,CHAPTER XV.,548
1849,"We judged that three nights more would fetch us to Cairo, at the bottomof Illinois, where the Ohio River comes in, and that was what we wasafter.",549
1850,"We would sell the raft and get on a steamboat and go way up theOhio amongst the free States, and then be out of trouble.",549
1851,"Well, the second night a fog begun to come on, and we made for atow-head to tie to, for it wouldn’t do to try to run in a fog; but whenI paddled ahead in the canoe, with the line to make fast, there warn’tanything but little saplings to tie to.",550
1852,"I passed the line around one ofthem right on the edge of the cut bank, but there was a stiff current,and the raft come booming down so lively she tore it out by the rootsand away she went.",550
1853,"I see the fog closing down, and it made me so sickand scared I couldn’t budge for most a half a minute it seemed tome—and then there warn’t no raft in sight; you couldn’t see twentyyards.",550
1854,"I jumped into the canoe and run back to the stern, and grabbedthe paddle and set her back a stroke.",550
1855,But she didn’t come.,550
1856,I was insuch a hurry I hadn’t untied her.,550
1857,"I got up and tried to untie her, butI was so excited my hands shook so I couldn’t hardly do anything withthem.",550
1858,"As soon as I got started I took out after the raft, hot and heavy,right down the tow-head.",551
1859,"That was all right as far as it went, but thetow-head warn’t sixty yards long, and the minute I flew by the foot ofit I shot out into the solid white fog, and hadn’t no more idea whichway I was going than a dead man.",551
1860,"Thinks I, it won’t do to paddle; first I know I’ll run into the bank ora tow-head or something; I got to set still and float, and yet it’smighty fidgety business to have to hold your hands still at such atime.",552
1861,I whooped and listened.,552
1862,"Away down there somewheres I hears asmall whoop, and up comes my spirits.",552
1863,"I went tearing after it,listening sharp to hear it again.",552
1864,"The next time it come, I see I warn’theading for it, but heading away to the right of it.",552
1865,"And the next timeI was heading away to the left of it—and not gaining on it much either,for I was flying around, this way and that and t’other, but it wasgoing straight ahead all the time.",552
1866,"I did wish the fool would think to beat a tin pan, and beat it all thetime, but he never did, and it was the still places between the whoopsthat was making the trouble for me.",553
1867,"Well, I fought along, and directlyI hears the whoop _behind_ me.",553
1868,I was tangled good now.,553
1869,"That wassomebody else’s whoop, or else I was turned around.",553
1870,I throwed the paddle down.,554
1871,"I heard the whoop again; it was behind meyet, but in a different place; it kept coming, and kept changing itsplace, and I kept answering, till by-and-by it was in front of meagain, and I knowed the current had swung the canoe’s head down-stream,and I was all right if that was Jim and not some other raftsmanhollering.",554
1872,"I couldn’t tell nothing about voices in a fog, for nothingdon’t look natural nor sound natural in a fog.",554
1873,"The whooping went on, and in about a minute I come a-booming down on acut bank with smoky ghosts of big trees on it, and the current throwedme off to the left and shot by, amongst a lot of snags that fairlyroared, the current was tearing by them so swift.",555
1874,In another second or two it was solid white and still again.,556
1875,"I setperfectly still then, listening to my heart thump, and I reckon Ididn’t draw a breath while it thumped a hundred.",556
1876,I just give up then.,557
1877,I knowed what the matter was.,557
1878,"That cut bank was anisland, and Jim had gone down t’other side of it.",557
1879,It warn’t no tow-headthat you could float by in ten minutes.,557
1880,It had the big timber of aregular island; it might be five or six miles long and more than half amile wide.,557
1881,"I kept quiet, with my ears cocked, about fifteen minutes, I reckon.",558
1882,"Iwas floating along, of course, four or five miles an hour; but youdon’t ever think of that.",558
1883,"No, you _feel_ like you are laying dead stillon the water; and if a little glimpse of a snag slips by you don’tthink to yourself how fast _you’re_ going, but you catch your breathand think, my!",558
1884,how that snag’s tearing along.,558
1885,"If you think it ain’tdismal and lonesome out in a fog that way by yourself in the night, youtry it once—you’ll see.",558
1886,"Next, for about a half an hour, I whoops now and then; at last I hearsthe answer a long ways off, and tries to follow it, but I couldn’t doit, and directly I judged I’d got into a nest of tow-heads, for I hadlittle dim glimpses of them on both sides of me—sometimes just a narrowchannel between, and some that I couldn’t see I knowed was therebecause I’d hear the wash of the current against the old dead brush andtrash that hung over the banks.",559
1887,"Well, I warn’t long loosing the whoopsdown amongst the tow-heads; and I only tried to chase them a littlewhile, anyway, because it was worse than chasing a Jack-o’-lantern.",559
1888,"Younever knowed a sound dodge around so, and swap places so quick and somuch.",559
1889,"I had to claw away from the bank pretty lively four or five times, tokeep from knocking the islands out of the river; and so I judged theraft must be butting into the bank every now and then, or else it wouldget further ahead and clear out of hearing—it was floating a littlefaster than what I was.",560
1890,"Well, I seemed to be in the open river again by-and-by, but I couldn’thear no sign of a whoop nowheres.",561
1891,"I reckoned Jim had fetched up on asnag, maybe, and it was all up with him.",561
1892,"I was good and tired, so Ilaid down in the canoe and said I wouldn’t bother no more.",561
1893,"I didn’twant to go to sleep, of course; but I was so sleepy I couldn’t help it;so I thought I would take jest one little cat-nap.",561
1894,"But I reckon it was more than a cat-nap, for when I waked up the starswas shining bright, the fog was all gone, and I was spinning down a bigbend stern first.",562
1895,First I didn’t know where I was; I thought I wasdreaming; and when things began to come back to me they seemed to comeup dim out of last week.,562
1896,"It was a monstrous big river here, with the tallest and the thickestkind of timber on both banks; just a solid wall, as well as I could seeby the stars.",563
1897,"I looked away down-stream, and seen a black speck on thewater.",563
1898,I took after it; but when I got to it it warn’t nothing but acouple of sawlogs made fast together.,563
1899,"Then I see another speck, andchased that; then another, and this time I was right.",563
1900,It was the raft.,563
1901,"When I got to it Jim was setting there with his head down between hisknees, asleep, with his right arm hanging over the steering-oar.",564
