,sentences,paragraph
4527,"So then I took the bearings of a woody island that was downthe river a piece, and as soon as it was fairly dark I crept out withmy raft and went for it, and hid it there, and then turned in.",1575
4528,"I sleptthe night through, and got up before it was light, and had mybreakfast, and put on my store clothes, and tied up some others and onething or another in a bundle, and took the canoe and cleared for shore.",1575
4529,"I landed below where I judged was Phelps’s place, and hid my bundle inthe woods, and then filled up the canoe with water, and loaded rocksinto her and sunk her where I could find her again when I wanted her,about a quarter of a mile below a little steam sawmill that was on thebank.",1575
4530,"Then I struck up the road, and when I passed the mill I see a sign onit, “Phelps’s Sawmill,” and when I come to the farm-houses, two orthree hundred yards further along, I kept my eyes peeled, but didn’tsee nobody around, though it was good daylight now.",1576
4531,"But I didn’t mind,because I didn’t want to see nobody just yet—I only wanted to get thelay of the land.",1576
4532,"According to my plan, I was going to turn up therefrom the village, not from below.",1576
4533,"So I just took a look, and shovedalong, straight for town.",1576
4534,"Well, the very first man I see when I gotthere was the duke.",1576
4535,He was sticking up a bill for the RoyalNonesuch—three-night performance—like that other time.,1576
4536,"_They_ had thecheek, them frauds!",1576
4537,I was right on him before I could shirk.,1576
4538,"He lookedastonished, and says:",1576
4539,"“Hel-_lo!_ Where’d _you_ come from?” Then he says, kind of glad andeager, “Where’s the raft?—got her in a good place?”",1577
4540,I says:,1578
4541,"“Why, that’s just what I was going to ask your grace.”",1579
4542,"Then he didn’t look so joyful, and says:",1580
4543,“What was your idea for asking _me?_” he says.,1581
4544,"“Well,” I says, “when I see the king in that doggery yesterday I saysto myself, we can’t get him home for hours, till he’s soberer; so Iwent a-loafing around town to put in the time and wait.",1582
4545,"A man up andoffered me ten cents to help him pull a skiff over the river and backto fetch a sheep, and so I went along; but when we was dragging him tothe boat, and the man left me a-holt of the rope and went behind him toshove him along, he was too strong for me and jerked loose and run, andwe after him.",1582
4546,"We didn’t have no dog, and so we had to chase him allover the country till we tired him out.",1582
4547,"We never got him till dark;then we fetched him over, and I started down for the raft.",1582
4548,"When I gotthere and see it was gone, I says to myself, ‘they’ve got into troubleand had to leave; and they’ve took my nigger, which is the only niggerI’ve got in the world, and now I’m in a strange country, and ain’t gotno property no more, nor nothing, and no way to make my living;’ so Iset down and cried.",1582
4549,I slept in the woods all night.,1582
4550,"But what _did_become of the raft, then?—and Jim—poor Jim!”",1582
4551,"“Blamed if _I_ know—that is, what’s become of the raft.",1583
4552,"That old foolhad made a trade and got forty dollars, and when we found him in thedoggery the loafers had matched half-dollars with him and got everycent but what he’d spent for whisky; and when I got him home late lastnight and found the raft gone, we said, ‘That little rascal has stoleour raft and shook us, and run off down the river.’”",1583
4553,"“I wouldn’t shake my _nigger_, would I?—the only nigger I had in theworld, and the only property.”",1584
4554,“We never thought of that.,1585
4555,"Fact is, I reckon we’d come to consider him_our_ nigger; yes, we did consider him so—goodness knows we had troubleenough for him.",1585
4556,"So when we see the raft was gone and we flat broke,there warn’t anything for it but to try the Royal Nonesuch anothershake.",1585
4557,"And I’ve pegged along ever since, dry as a powder-horn.",1585
4558,Where’sthat ten cents?,1585
4559,Give it here.”,1585
4560,"I had considerable money, so I give him ten cents, but begged him tospend it for something to eat, and give me some, because it was all themoney I had, and I hadn’t had nothing to eat since yesterday.",1586
4561,He neversaid nothing.,1586
4562,The next minute he whirls on me and says:,1586
4563,“Do you reckon that nigger would blow on us?,1587
4564,We’d skin him if he donethat!”,1587
4565,“How can he blow?,1588
4566,Hain’t he run off?”,1588
4567,“No!,1589
4568,"That old fool sold him, and never divided with me, and the money’sgone.”",1589
4569,"“_Sold_ him?” I says, and begun to cry; “why, he was _my_ nigger, andthat was my money.",1590
4570,Where is he?—I want my nigger.”,1590
4571,"“Well, you can’t _get_ your nigger, that’s all—so dry up yourblubbering.",1591
4572,Looky here—do you think _you’d_ venture to blow on us?,1591
4573,Blamed if I think I’d trust you.,1591
4574,"Why, if you _was_ to blow on us—”",1591
4575,"He stopped, but I never see the duke look so ugly out of his eyesbefore.",1592
4576,"I went on a-whimpering, and says:",1592
4577,"“I don’t want to blow on nobody; and I ain’t got no time to blow,nohow.",1593
4578,I got to turn out and find my nigger.”,1593
4579,"He looked kinder bothered, and stood there with his bills fluttering onhis arm, thinking, and wrinkling up his forehead.",1594
4580,At last he says:,1594
4581,“I’ll tell you something.,1595
4582,We got to be here three days.,1595
4583,"If you’llpromise you won’t blow, and won’t let the nigger blow, I’ll tell youwhere to find him.”",1595
4584,"So I promised, and he says:",1596
4585,“A farmer by the name of Silas Ph—” and then he stopped.,1597
4586,"You see, hestarted to tell me the truth; but when he stopped that way, and begunto study and think again, I reckoned he was changing his mind.",1597
4587,And sohe was.,1597
4588,He wouldn’t trust me; he wanted to make sure of having me outof the way the whole three days.,1597
4589,So pretty soon he says:,1597
4590,"“The man that bought him is named Abram Foster—Abram G. Foster—and helives forty mile back here in the country, on the road to Lafayette.”",1598
4591,"“All right,” I says, “I can walk it in three days.",1599
4592,And I’ll start thisvery afternoon.”,1599
4593,"“No you wont, you’ll start _now;_ and don’t you lose any time about it,neither, nor do any gabbling by the way.",1600
4594,"Just keep a tight tongue inyour head and move right along, and then you won’t get into troublewith _us_, d’ye hear?”",1600
4595,"That was the order I wanted, and that was the one I played for.",1601
4596,Iwanted to be left free to work my plans.,1601
4597,"“So clear out,” he says; “and you can tell Mr. Foster whatever you wantto.",1602
4598,Maybe you can get him to believe that Jim _is_ your nigger—someidiots don’t require documents—leastways I’ve heard there’s such downSouth here.,1602
4599,"And when you tell him the handbill and the reward’s bogus,maybe he’ll believe you when you explain to him what the idea was forgetting ’em out.",1602
4600,"Go ’long now, and tell him anything you want to; butmind you don’t work your jaw any _between_ here and there.”",1602
4601,"So I left, and struck for the back country.",1603
4602,"I didn’t look around, but Ikinder felt like he was watching me.",1603
4603,But I knowed I could tire him outat that.,1603
4604,I went straight out in the country as much as a mile before Istopped; then I doubled back through the woods towards Phelps’.,1603
4605,"Ireckoned I better start in on my plan straight off without foolingaround, because I wanted to stop Jim’s mouth till these fellows couldget away.",1603
4606,I didn’t want no trouble with their kind.,1603
4607,"I’d seen all Iwanted to of them, and wanted to get entirely shut of them.",1603
4608,CHAPTER XXXII.,1605
4609,"When I got there it was all still and Sunday-like, and hot andsunshiny; the hands was gone to the fields; and there was them kind offaint dronings of bugs and flies in the air that makes it seem solonesome and like everybody’s dead and gone; and if a breeze fans alongand quivers the leaves it makes you feel mournful, because you feellike it’s spirits whispering—spirits that’s been dead ever so manyyears—and you always think they’re talking about _you_.",1606
4610,"As a generalthing it makes a body wish _he_ was dead, too, and done with it all.",1606
4611,"Phelps’ was one of these little one-horse cotton plantations, and theyall look alike.",1607
4612,"A rail fence round a two-acre yard; a stile made out oflogs sawed off and up-ended in steps, like barrels of a differentlength, to climb over the fence with, and for the women to stand onwhen they are going to jump on to a horse; some sickly grass-patches inthe big yard, but mostly it was bare and smooth, like an old hat withthe nap rubbed off; big double log-house for the white folks—hewedlogs, with the chinks stopped up with mud or mortar, and thesemud-stripes been whitewashed some time or another; round-log kitchen,with a big broad, open but roofed passage joining it to the house; logsmoke-house back of the kitchen; three little log nigger-cabins in arow t’other side the smoke-house; one little hut all by itself awaydown against the back fence, and some outbuildings down a piece theother side; ash-hopper and big kettle to bile soap in by the littlehut; bench by the kitchen door, with bucket of water and a gourd; houndasleep there in the sun; more hounds asleep round about; about threeshade trees away off in a corner; some currant bushes and gooseberrybushes in one place by the fence; outside of the fence a garden and awatermelon patch; then the cotton fields begins, and after the fieldsthe woods.",1607
4613,"I went around and clumb over the back stile by the ash-hopper, andstarted for the kitchen.",1608
4614,When I got a little ways I heard the dim humof a spinning-wheel wailing along up and sinking along down again; andthen I knowed for certain I wished I was dead—for that _is_ thelonesomest sound in the whole world.,1608
4615,"I went right along, not fixing up any particular plan, but justtrusting to Providence to put the right words in my mouth when the timecome; for I’d noticed that Providence always did put the right words inmy mouth if I left it alone.",1609
4616,"When I got half-way, first one hound and then another got up and wentfor me, and of course I stopped and faced them, and kept still.",1610
4617,Andsuch another powwow as they made!,1610
4618,"In a quarter of a minute I was a kindof a hub of a wheel, as you may say—spokes made out of dogs—circle offifteen of them packed together around me, with their necks and nosesstretched up towards me, a-barking and howling; and more a-coming; youcould see them sailing over fences and around corners from everywheres.",1610
4619,"A nigger woman come tearing out of the kitchen with a rolling-pin inher hand, singing out, “Begone _you_ Tige!",1611
4620,you Spot!,1611
4621,"begone sah!” andshe fetched first one and then another of them a clip and sent themhowling, and then the rest followed; and the next second half of themcome back, wagging their tails around me, and making friends with me.",1611
4622,"There ain’t no harm in a hound, nohow.",1611
4623,"And behind the woman comes a little nigger girl and two little niggerboys without anything on but tow-linen shirts, and they hung on totheir mother’s gown, and peeped out from behind her at me, bashful, theway they always do.",1612
4624,"And here comes the white woman running from thehouse, about forty-five or fifty year old, bareheaded, and herspinning-stick in her hand; and behind her comes her little whitechildren, acting the same way the little niggers was doing.",1612
4625,She wassmiling all over so she could hardly stand—and says:,1612
4626,"“It’s _you_, at last!—_ain’t_ it?”",1613
4627,I out with a “Yes’m” before I thought.,1614
4628,"She grabbed me and hugged me tight; and then gripped me by both handsand shook and shook; and the tears come in her eyes, and run down over;and she couldn’t seem to hug and shake enough, and kept saying, “Youdon’t look as much like your mother as I reckoned you would; but lawsakes, I don’t care for that, I’m _so_ glad to see you!",1615
4629,"Dear, dear, itdoes seem like I could eat you up!",1615
4630,"Children, it’s your cousin Tom!—tellhim howdy.”",1615
4631,"But they ducked their heads, and put their fingers in their mouths, andhid behind her.",1616
4632,So she run on:,1616
4633,"“Lize, hurry up and get him a hot breakfast right away—or did you getyour breakfast on the boat?”",1617
4634,I said I had got it on the boat.,1618
4635,"So then she started for the house,leading me by the hand, and the children tagging after.",1618
4636,"When we gotthere she set me down in a split-bottomed chair, and set herself downon a little low stool in front of me, holding both of my hands, andsays:",1618
4637,"“Now I can have a _good_ look at you; and, laws-a-me, I’ve been hungryfor it a many and a many a time, all these long years, and it’s come atlast!",1619
4638,We been expecting you a couple of days and more.,1619
4639,What kep’you?—boat get aground?”,1619
4640,“Yes’m—she—”,1620
4641,“Don’t say yes’m—say Aunt Sally.,1621
4642,Where’d she get aground?”,1621
4643,"I didn’t rightly know what to say, because I didn’t know whether theboat would be coming up the river or down.",1622
4644,But I go a good deal oninstinct; and my instinct said she would be coming up—from down towardsOrleans.,1622
4645,"That didn’t help me much, though; for I didn’t know the namesof bars down that way.",1622
4646,"I see I’d got to invent a bar, or forget thename of the one we got aground on—or—Now I struck an idea, and fetchedit out:",1622
4647,“It warn’t the grounding—that didn’t keep us back but a little.,1623
4648,Weblowed out a cylinder-head.”,1623
4649,“Good gracious!,1624
4650,anybody hurt?”,1624
4651,“No’m.,1625
4652,Killed a nigger.”,1625
4653,"“Well, it’s lucky; because sometimes people do get hurt.",1626
4654,"Two years agolast Christmas your uncle Silas was coming up from Newrleans on the old_Lally Rook_, and she blowed out a cylinder-head and crippled a man.",1626
4655,And I think he died afterwards.,1626
4656,He was a Baptist.,1626
4657,Your uncle Silasknowed a family in Baton Rouge that knowed his people very well.,1626
4658,"Yes, Iremember now, he _did_ die.",1626
4659,"Mortification set in, and they had toamputate him.",1626
4660,But it didn’t save him.,1626
4661,"Yes, it was mortification—thatwas it.",1626
4662,"He turned blue all over, and died in the hope of a gloriousresurrection.",1626
4663,They say he was a sight to look at.,1626
4664,Your uncle’s been upto the town every day to fetch you.,1626
4665,"And he’s gone again, not more’n anhour ago; he’ll be back any minute now.",1626
4666,"You must a met him on the road,didn’t you?—oldish man, with a—”",1626
4667,"“No, I didn’t see nobody, Aunt Sally.",1627
4668,"The boat landed just at daylight,and I left my baggage on the wharf-boat and went looking around thetown and out a piece in the country, to put in the time and not gethere too soon; and so I come down the back way.”",1627
4669,“Who’d you give the baggage to?”,1628
4670,“Nobody.”,1629
4671,"“Why, child, it’ll be stole!”",1630
4672,"“Not where _I_ hid it I reckon it won’t,” I says.",1631
4673,“How’d you get your breakfast so early on the boat?”,1632
4674,"It was kinder thin ice, but I says:",1633
4675,"“The captain see me standing around, and told me I better havesomething to eat before I went ashore; so he took me in the texas tothe officers’ lunch, and give me all I wanted.”",1634
4676,I was getting so uneasy I couldn’t listen good.,1635
4677,"I had my mind on thechildren all the time; I wanted to get them out to one side and pumpthem a little, and find out who I was.",1635
4678,"But I couldn’t get no show, Mrs.Phelps kept it up and run on so.",1635
4679,"Pretty soon she made the cold chillsstreak all down my back, because she says:",1635
4680,"“But here we’re a-running on this way, and you hain’t told me a wordabout Sis, nor any of them.",1636
4681,"Now I’ll rest my works a little, and youstart up yourn; just tell me _everything_—tell me all about ’m allevery one of ’m; and how they are, and what they’re doing, and whatthey told you to tell me; and every last thing you can think of.”",1636
4682,"Well, I see I was up a stump—and up it good.",1637
4683,"Providence had stood by methis fur all right, but I was hard and tight aground now.",1637
4684,I see itwarn’t a bit of use to try to go ahead—I’d _got_ to throw up my hand.,1637
4685,"So I says to myself, here’s another place where I got to resk thetruth.",1637
4686,"I opened my mouth to begin; but she grabbed me and hustled me inbehind the bed, and says:",1637
4687,“Here he comes!,1638
4688,"Stick your head down lower—there, that’ll do; you can’tbe seen now.",1638
4689,Don’t you let on you’re here.,1638
4690,I’ll play a joke on him.,1638
4691,"Children, don’t you say a word.”",1638
4692,I see I was in a fix now.,1639
4693,"But it warn’t no use to worry; there warn’tnothing to do but just hold still, and try and be ready to stand fromunder when the lightning struck.",1639
4694,I had just one little glimpse of the old gentleman when he come in;then the bed hid him.,1640
4695,"Mrs. Phelps she jumps for him, and says:",1640
4696,“Has he come?”,1641
4697,"“No,” says her husband.",1642
4698,"“Good-_ness_ gracious!” she says, “what in the warld can have become ofhim?”",1643
4699,"“I can’t imagine,” says the old gentleman; “and I must say it makes medreadful uneasy.”",1644
4700,“Uneasy!” she says; “I’m ready to go distracted!,1645
4701,He _must_ a come; andyou’ve missed him along the road.,1645
4702,I _know_ it’s so—something tells meso.”,1645
4703,"“Why, Sally, I _couldn’t_ miss him along the road—_you_ know that.”",1646
4704,"“But oh, dear, dear, what _will_ Sis say!",1647
4705,He must a come!,1647
4706,You must amissed him.,1647
4707,He—”,1647
4708,"“Oh, don’t distress me any more’n I’m already distressed.",1648
4709,I don’t knowwhat in the world to make of it.,1648
4710,"I’m at my wit’s end, and I don’t mindacknowledging ’t I’m right down scared.",1648
4711,But there’s no hope that he’scome; for he _couldn’t_ come and me miss him.,1648
4712,"Sally, it’s terrible—justterrible—something’s happened to the boat, sure!”",1648
4713,"“Why, Silas!",1649
4714,Look yonder!—up the road!—ain’t that somebody coming?”,1649
4715,"He sprung to the window at the head of the bed, and that give Mrs.Phelps the chance she wanted.",1650
4716,"She stooped down quick at the foot of thebed and give me a pull, and out I come; and when he turned back fromthe window there she stood, a-beaming and a-smiling like a house afire,and I standing pretty meek and sweaty alongside.",1650
4717,"The old gentlemanstared, and says:",1650
4718,"“Why, who’s that?”",1651
4719,“Who do you reckon ’t is?”,1652
4720,“I hain’t no idea.,1653
4721,Who _is_ it?”,1653
4722,“It’s _Tom Sawyer!_”,1654
4723,"By jings, I most slumped through the floor!",1655
4724,"But there warn’t no time toswap knives; the old man grabbed me by the hand and shook, and kept onshaking; and all the time how the woman did dance around and laugh andcry; and then how they both did fire off questions about Sid, and Mary,and the rest of the tribe.",1655
4725,"But if they was joyful, it warn’t nothing to what I was; for it waslike being born again, I was so glad to find out who I was.",1656
4726,"Well, theyfroze to me for two hours; and at last, when my chin was so tired itcouldn’t hardly go any more, I had told them more about my family—Imean the Sawyer family—than ever happened to any six Sawyer families.",1656
4727,"And I explained all about how we blowed out a cylinder-head at themouth of White River, and it took us three days to fix it.",1656
4728,"Which wasall right, and worked first-rate; because _they_ didn’t know but whatit would take three days to fix it.",1656
4729,If I’d a called it a bolthead itwould a done just as well.,1656
4730,"Now I was feeling pretty comfortable all down one side, and prettyuncomfortable all up the other.",1657
4731,"Being Tom Sawyer was easy andcomfortable, and it stayed easy and comfortable till by-and-by I hear asteamboat coughing along down the river.",1657
4732,"Then I says to myself, s’poseTom Sawyer comes down on that boat?",1657
4733,"And s’pose he steps in here anyminute, and sings out my name before I can throw him a wink to keepquiet?",1657
4734,"Well, I couldn’t _have_ it that way; it wouldn’t do at all.",1657
4735,Imust go up the road and waylay him.,1657
4736,So I told the folks I reckoned Iwould go up to the town and fetch down my baggage.,1657
4737,"The old gentlemanwas for going along with me, but I said no, I could drive the horsemyself, and I druther he wouldn’t take no trouble about me.",1657
4738,CHAPTER XXXIII.,1659
4739,"So I started for town in the wagon, and when I was half-way I see awagon coming, and sure enough it was Tom Sawyer, and I stopped andwaited till he come along.",1660
4740,"I says “Hold on!” and it stopped alongside,and his mouth opened up like a trunk, and stayed so; and he swallowedtwo or three times like a person that’s got a dry throat, and thensays:",1660
4741,“I hain’t ever done you no harm.,1661
4742,You know that.,1661
4743,"So, then, what you wantto come back and ha’nt _me_ for?”",1661
4744,I says:,1662
4745,“I hain’t come back—I hain’t been _gone_.”,1663
4746,"When he heard my voice it righted him up some, but he warn’t quitesatisfied yet.",1664
4747,He says:,1664
4748,"“Don’t you play nothing on me, because I wouldn’t on you.",1665
4749,"Honest injunnow, you ain’t a ghost?”",1665
4750,"“Honest injun, I ain’t,” I says.",1666
4751,"“Well—I—I—well, that ought to settle it, of course; but I can’t somehowseem to understand it no way.",1667
4752,"Looky here, warn’t you ever murdered _atall?_”",1667
4753,“No.,1668
4754,I warn’t ever murdered at all—I played it on them.,1668
4755,You come inhere and feel of me if you don’t believe me.”,1668
4756,So he done it; and it satisfied him; and he was that glad to see meagain he didn’t know what to do.,1669
4757,"And he wanted to know all about itright off, because it was a grand adventure, and mysterious, and so ithit him where he lived.",1669
4758,"But I said, leave it alone till by-and-by; andtold his driver to wait, and we drove off a little piece, and I toldhim the kind of a fix I was in, and what did he reckon we better do?",1669
4759,"Hesaid, let him alone a minute, and don’t disturb him.",1669
4760,"So he thought andthought, and pretty soon he says:",1669
4761,“It’s all right; I’ve got it.,1670
4762,"Take my trunk in your wagon, and let onit’s your’n; and you turn back and fool along slow, so as to get to thehouse about the time you ought to; and I’ll go towards town a piece,and take a fresh start, and get there a quarter or a half an hour afteryou; and you needn’t let on to know me at first.”",1670
4763,I says:,1671
4764,“All right; but wait a minute.,1672
4765,There’s one more thing—a thing that_nobody_ don’t know but me.,1672
4766,"And that is, there’s a nigger here that I’ma-trying to steal out of slavery, and his name is _Jim_—old MissWatson’s Jim.”",1672
4767,He says:,1673
4768,“What!,1674
4769,"Why, Jim is—”",1674
4770,He stopped and went to studying.,1675
4771,I says:,1675
4772,“_I_ know what you’ll say.,1676
4773,"You’ll say it’s dirty, low-down business;but what if it is?",1676
4774,"_I_’m low down; and I’m a-going to steal him, and Iwant you keep mum and not let on.",1676
4775,Will you?”,1676
4776,"His eye lit up, and he says:",1677
4777,“I’ll _help_ you steal him!”,1678
4778,"Well, I let go all holts then, like I was shot.",1679
4779,It was the mostastonishing speech I ever heard—and I’m bound to say Tom Sawyer fellconsiderable in my estimation.,1679
4780,Only I couldn’t believe it.,1679
4781,Tom Sawyer a_nigger stealer!_,1679
4782,"“Oh, shucks!” I says; “you’re joking.”",1680
4783,"“I ain’t joking, either.”",1681
4784,"“Well, then,” I says, “joking or no joking, if you hear anything saidabout a runaway nigger, don’t forget to remember that _you_ don’t knownothing about him, and _I_ don’t know nothing about him.”",1682
4785,"Then we took the trunk and put it in my wagon, and he drove off his wayand I drove mine.",1683
4786,But of course I forgot all about driving slow onaccounts of being glad and full of thinking; so I got home a heap tooquick for that length of a trip.,1683
4787,"The old gentleman was at the door, andhe says:",1683
4788,"“Why, this is wonderful!",1684
4789,Whoever would a thought it was in that mare todo it?,1684
4790,I wish we’d a timed her.,1684
4791,And she hain’t sweated a hair—not ahair.,1684
4792,It’s wonderful.,1684
4793,"Why, I wouldn’t take a hundred dollars for thathorse now—I wouldn’t, honest; and yet I’d a sold her for fifteenbefore, and thought ’twas all she was worth.”",1684
4794,That’s all he said.,1685
4795,"He was the innocentest, best old soul I ever see.",1685
